ts_code,ann_date,end_date,type,p_change_min,p_change_max,net_profit_min,net_profit_max,last_parent_net,first_ann_date,summary,change_reason,update_flag
000050.SZ,20210708,20210630,预增,55.83,74.63,116000.0,130000.0,74441.8,20210708,预计:净利润116000-130000,"报告期内,行业景气度持续上行,公司保持产线满产满销,不断提升运营效率,优化产品结构,深化成本改善力度,有效提升了经营质量和盈利水平.同时,公司将依托在LTPS领域的领先优势,抢抓产品规格升级的机遇,持续加大开拓LTPS中尺寸显示市场(平板,笔电,车载)的力度.",1
000050.SZ,20210708,20210630,预增,55.83,74.63,116000.0,130000.0,74441.8,20210708,预计净利润116000-130000万,"报告期内,行业景气度持续上行,公司保持产线满产满销,不断提升运营效率,优化产品结构,深化成本改善力度,有效提升了经营质量和盈利水平.同时,公司将依托在LTPS领域的领先优势,抢抓产品规格升级的机遇,持续加大开拓LTPS中尺寸显示市场(平板,笔电,车载)的力度.",0
000050.SZ,20210407,20210331,预增,65.93,82.52,50000.0,55000.0,30133.9,20210407,预计:净利润50000-55000,"报告期内,行业景气度保持上行,公司不断夯实经营管理能力,持续提升运营效率,强化综合竞争力,积极把握了市场机遇,保持了产线满产满销,有效提升了经营质量和盈利水平.",1
000050.SZ,20210407,20210331,预增,65.93,82.52,50000.0,55000.0,30133.9,20210407,预计净利润50000-55000万,"报告期内,行业景气度保持上行,公司不断夯实经营管理能力,持续提升运营效率,强化综合竞争力,积极把握了市场机遇,保持了产线满产满销,有效提升了经营质量和盈利水平.",0
000050.SZ,20210114,20201231,预增,74.83,98.95,145000.0,165000.0,82936.5,20210114,预计净利润145000-165000万,"公司通过技术创新加速产品升级,持续优化产品结构,不断加大高附加值产品出货占比,在突发新型冠状病毒肺炎疫情给产业链发展带来挑战的情况下,公司尽最大努力确保交付,叠加5G推进驱动,公司抢抓市场机遇,主要产品需求旺盛,同时不断深化成本改善力度,有效提升了经营质量和盈利水平.",0
