ts_code,ann_date,end_date,type,p_change_min,p_change_max,net_profit_min,net_profit_max,last_parent_net,first_ann_date,summary,change_reason,update_flag
000063.SZ,20220129,20211231,预增,52.59,69.02,650000.0,720000.0,425975.2,20220129,预计:净利润650000-720000,本集团2021年度业绩较上年同期增长，主要为以下原因综合影响所致：（1）2021年营业收入实现双位数同比增长，其中，国内、国际市场和运营商网络、政企、消费者三大业务营业收入均实现同比增长。（2）2021年毛利率同比恢复改善。（3）2021年资产减值损失预计约14亿元人民币，其中第四季度单季度资产减值损失约11亿元人民币，主要由于全球芯片供应紧张情况下，公司对关键物料提前备料，考虑到公司备料及生产周期相对较长，与前期政策保持一致，基于谨慎性原则计提存货跌价准备。,1
000063.SZ,20220129,20211231,预增,52.59,69.02,650000.0,720000.0,425975.2,20220129,预计净利润650000-720000万,本集团2021年度业绩较上年同期增长，主要为以下原因综合影响所致：（1）2021年营业收入实现双位数同比增长，其中，国内、国际市场和运营商网络、政企、消费者三大业务营业收入均实现同比增长。（2）2021年毛利率同比恢复改善。（3）2021年资产减值损失预计约14亿元人民币，其中第四季度单季度资产减值损失约11亿元人民币，主要由于全球芯片供应紧张情况下，公司对关键物料提前备料，考虑到公司备料及生产周期相对较长，与前期政策保持一致，基于谨慎性原则计提存货跌价准备。,0
000063.SZ,20211015,20210930,预增,106.49,121.23,560000.0,600000.0,271204.9,20211015,预计:净利润560000-600000,三、业绩变动原因说明本集团2021年1-9月预计归属于上市公司普通股股东的净利润较上年同期增长，主要原因为：1、公司不断优化市场格局，营业收入同比增长、毛利率持续恢复改善，盈利能力大幅提升；2、本公司转让北京中兴高达通信技术有限公司90%股权，确认税前利润约8亿元人民币。,1
000063.SZ,20211015,20210930,预增,106.49,121.23,560000.0,600000.0,271204.9,20211015,预计净利润560000-600000万,三、业绩变动原因说明本集团2021年1-9月预计归属于上市公司普通股股东的净利润较上年同期增长，主要原因为：1、公司不断优化市场格局，营业收入同比增长、毛利率持续恢复改善，盈利能力大幅提升；2、本公司转让北京中兴高达通信技术有限公司90%股权，确认税前利润约8亿元人民币。,0
000063.SZ,20210710,20210630,预增,104.6,131.52,380000.0,430000.0,185728.9,20210710,预计:净利润380000-430000,"本报告期,本集团预计归属于上市公司普通股股东的净利润较上年同期增长,主要原因为:1,公司不断优化市场格局,本报告期营业收入同比增长,毛利率持续恢复改善,盈利能力大幅提升;2,本报告期本公司转让北京中兴高达通信技术有限公司90%股权,确认税前利润约8亿元人民币.",1
000063.SZ,20210710,20210630,预增,104.6,131.52,380000.0,430000.0,185728.9,20210710,预计净利润380000-430000万,"本报告期,本集团预计归属于上市公司普通股股东的净利润较上年同期增长,主要原因为:1,公司不断优化市场格局,本报告期营业收入同比增长,毛利率持续恢复改善,盈利能力大幅提升;2,本报告期本公司转让北京中兴高达通信技术有限公司90%股权,确认税前利润约8亿元人民币.",0
000063.SZ,20210317,20210331,预增,130.77,207.7,180000.0,240000.0,77998.8,20210317,预计:净利润180000-240000,本报告期，本集团预计归属于上市公司普通股股东的净利润较上年同期增长，主要原因为：1、公司不断优化市场格局，本报告期营业收入同比增长、毛利率持续恢复改善，盈利能力大幅提升；2、本报告期本公司转让北京中兴高达通信技术有限公司90%股权，确认税前利润约7.74亿元人民币。,1
000063.SZ,20210317,20210331,预增,130.77,207.7,180000.0,240000.0,77998.8,20210317,预计净利润180000-240000万,本报告期，本集团预计归属于上市公司普通股股东的净利润较上年同期增长，主要原因为：1、公司不断优化市场格局，本报告期营业收入同比增长、毛利率持续恢复改善，盈利能力大幅提升；2、本报告期本公司转让北京中兴高达通信技术有限公司90%股权，确认税前利润约7.74亿元人民币。,0
