ts_code,ann_date,end_date,type,p_change_min,p_change_max,net_profit_min,net_profit_max,last_parent_net,first_ann_date,summary,change_reason,update_flag
000410.SZ,20260131,20251231,首亏,-118.6239,-109.312,-1500.0,-750.0,8054.16,20260131,预计:净利润-1500--750,本报告期内市场整体延续激烈竞争态势，叠加2025年度公司政府补助金额大幅减少，导致本报告期公司归母净利润为负值。但本报告期公司扣除非经常性损益后的净利润亏损幅度收窄，主营业务发展态势向好。报告期内，公司持续严控费用，加强经营管理，积极拓展市场，提升市场份额。公司将深入推进高端化、智能化、绿色化转型，切实扛牢服务国家战略的使命责任。聚焦主责主业，把做强做优高端数控机床产品作为根本任务，系统推进产品升级、整合与聚焦，推动企业整体竞争力迈上新台阶。2025年公司实施发行股份购买资产并募集配套资金重大资产重组项目，三家标的公司于2025年6月30日正式纳入公司合并报表范围。上述三家公司2025年上半年损益情况在非经常性损益项目“同一控制下企业合并产生的子公司期初至合并日的当期净损益”下列报，导致公司扣除非经常性损益后的净利润与归属于上市公司股东的净利润差异较大。,1
000410.SZ,20260131,20251231,首亏,-118.6239,-109.312,-1500.0,-750.0,8054.16,20260131,预计:净利润-1500--750,本报告期内市场整体延续激烈竞争态势，叠加2025年度公司政府补助金额大幅减少，导致本报告期公司归母净利润为负值。但本报告期公司扣除非经常性损益后的净利润亏损幅度收窄，主营业务发展态势向好。报告期内，公司持续严控费用，加强经营管理，积极拓展市场，提升市场份额。公司将深入推进高端化、智能化、绿色化转型，切实扛牢服务国家战略的使命责任。聚焦主责主业，把做强做优高端数控机床产品作为根本任务，系统推进产品升级、整合与聚焦，推动企业整体竞争力迈上新台阶。2025年公司实施发行股份购买资产并募集配套资金重大资产重组项目，三家标的公司于2025年6月30日正式纳入公司合并报表范围。上述三家公司2025年上半年损益情况在非经常性损益项目“同一控制下企业合并产生的子公司期初至合并日的当期净损益”下列报，导致公司扣除非经常性损益后的净利润与归属于上市公司股东的净利润差异较大。,0
000410.SZ,20250715,20250630,扭亏,171.1382,191.4634,3500.0,4500.0,-4920.0,20250715,预计:净利润3500-4500,本报告期预计归属于上市公司股东的净利润同比增加（原报告数据），一方面是2025年公司实施发行股份购买资产并募集配套资金项目，已完成发行股份购买资产部分，三家标的公司于2025年6月30日正式纳入公司合并报表范围，三家标的公司盈利较好；另一方面上市公司通过深耕行业，提质增效等多项措施，报告期内经营效果不断提升。,0
000410.SZ,20240710,20240630,续亏,-51.5225,-17.8509,-9000.0,-7000.0,-5939.71,20240710,预计:净利润-9000--7000,报告期内，机床市场整体需求不旺，市场竞争压力加剧，使得公司经营业绩亏损。2024年下半年，公司积极应对市场竞争，深入推进降本增效，加大国内外市场开拓力度，通过加强重点领域开拓，持续优化产品竞争能力，努力提升公司经营效益。,1
000410.SZ,20240710,20240630,续亏,-51.5225,-17.8509,-9000.0,-7000.0,-5939.71,20240710,预计:净利润-9000--7000,报告期内，机床市场整体需求不旺，市场竞争压力加剧，使得公司经营业绩亏损。2024年下半年，公司积极应对市场竞争，深入推进降本增效，加大国内外市场开拓力度，通过加强重点领域开拓，持续优化产品竞争能力，努力提升公司经营效益。,0
000410.SZ,20240127,20231231,预增,4.83,55.3,2700.0,4000.0,2575.6,20240127,预计:净利润2700-4000,"本年度，公司以“研发、技改、市场”为主线，围绕总体工作思路，聚焦主责主业，全力抢占市场，深化业财融合，加强精益管控，经营业绩持续向好，进一步巩固了扭亏脱困成果。本年度，公司预计扣除非经常性损益后的净利润为亏损20,000万元至30,000万元，比上年同期下降7.28%至60.92%。预计非经常性损益对公司净利润的影响金额为24,000万元至32,700万元，主要系债务重组、政府补助以及子公司强制清算对损益的影响，上年同期非经常性损益金额为21,217.95万元。",1
000410.SZ,20240127,20231231,预增,4.83,55.3,2700.0,4000.0,2575.6,20240127,预计:净利润2700-4000,"本年度，公司以“研发、技改、市场”为主线，围绕总体工作思路，聚焦主责主业，全力抢占市场，深化业财融合，加强精益管控，经营业绩持续向好，进一步巩固了扭亏脱困成果。本年度，公司预计扣除非经常性损益后的净利润为亏损20,000万元至30,000万元，比上年同期下降7.28%至60.92%。预计非经常性损益对公司净利润的影响金额为24,000万元至32,700万元，主要系债务重组、政府补助以及子公司强制清算对损益的影响，上年同期非经常性损益金额为21,217.95万元。",0
000410.SZ,20230714,20230630,首亏,-692.1472,-601.0476,-6500.0,-5500.0,1097.7,20230714,预计:净利润-6500--5500,报告期内，受部分行业需求下降及市场竞争加剧等因素的影响，公司销售规模有所下降，公司半年度归属于上市公司股东的净利润预计为亏损。公司将通过加强重点领域开拓，持续优化产品竞争能力，努力提升公司经营效益。,1
000410.SZ,20230714,20230630,首亏,-692.1472,-601.0476,-6500.0,-5500.0,1097.7,20230714,预计:净利润-6500--5500,报告期内，受部分行业需求下降及市场竞争加剧等因素的影响，公司销售规模有所下降，公司半年度归属于上市公司股东的净利润预计为亏损。公司将通过加强重点领域开拓，持续优化产品竞争能力，努力提升公司经营效益。,0
000410.SZ,20230131,20221231,扭亏,102.08,103.13,1800.0,2700.0,-86331.99,20230131,预计:净利润1800-2700,"面对需求收缩、供给冲击压力持续显现等严峻复杂的形势，公司聚焦战略，提高全业务链条运营管控能力，确保经营规模保持稳定。全面开展精益管理，着力推进技术改造。圆满完成定向增发，资本结构大幅改善。公司实现扭亏为盈。1.债务重组收益影响11,000万元至13,500万元一是公司及下属子公司与部分供应商签署《债权债务豁免协议》，形成债务重组利得6,700万元至7,700万元。二是公司根据《重整计划》及企业会计准则相关要求，确认债务重组收益约3,500万元至4,500万元。三是根据安徽省高级人民法院相关司法裁定及相关债权人出具的债权说明，公司调整预留司法重整偿债资源，确认债务重组收益800万元至1,300万元。2.子公司破产清算收益3,000万元至4,000万元2022年1月，公司子公司希斯机床（沈阳）有限责任公司进入破产清算程序。子公司希斯机床（沈阳）有限责任公司破产清算对公司经营性损益影响金额-7,000万元至-8,000万元，主要为往来款项减值；对公司非经营性损益影响金额为10,000万元至12,000万元，主要为合并报表层面确认的投资收益及资本金损失。希斯机床（沈阳）有限责任公司破产清算事宜对公司整体业绩的影响为3,000万元至4,000万元。",1
000410.SZ,20220715,20220630,扭亏,104.48,106.72,800.0,1200.0,-17846.23,20220715,预计:净利润800-1200,"1.公司聚焦战略解码落地，提升全业务链条运营管控能力,经营业绩已逐步改善。报告期内，公司实现归属于上市公司股东的净利润为800万元至1,200万元，与上年同期相比实现扭亏为盈。2.2022年1月，公司子公司希斯机床（沈阳）有限责任公司进入破产清算程序。子公司希斯机床（沈阳）有限责任公司破产清算对公司经营性损益影响金额-7,000万元至-8,000万元，主要为往来款项减值；对公司非经营性损益影响金额为10,000万元至12,000万元，主要为合并报表层面确认的投资收益及资本金损失。希斯机床（沈阳）有限责任公司破产清算事宜对公司整体业绩的影响为3,000万元至4,000万元。",1
000410.SZ,20220715,20220630,扭亏,104.48,106.72,800.0,1200.0,-17846.23,20220715,预计净利润800-1200万,"1.公司聚焦战略解码落地，提升全业务链条运营管控能力,经营业绩已逐步改善。报告期内，公司实现归属于上市公司股东的净利润为800万元至1,200万元，与上年同期相比实现扭亏为盈。2.2022年1月，公司子公司希斯机床（沈阳）有限责任公司进入破产清算程序。子公司希斯机床（沈阳）有限责任公司破产清算对公司经营性损益影响金额-7,000万元至-8,000万元，主要为往来款项减值；对公司非经营性损益影响金额为10,000万元至12,000万元，主要为合并报表层面确认的投资收益及资本金损失。希斯机床（沈阳）有限责任公司破产清算事宜对公司整体业绩的影响为3,000万元至4,000万元。",0
000410.SZ,20220126,20211231,续亏,-38.36,-10.69,-100000.0,-80000.0,-72276.05,20220126,预计:净利润-100000--80000,1.2021年度，全资子公司优工业破产清算对公司经营性损益影响金额-18.00亿元至-19.00亿元，主要为往来款项减值，对公司非经常性损益影响金额为15.50亿元至16.00亿元，主要为长期股权投资减值、合并报表层面确认的投资收益及计提的预计负债。优工业破产清算事项对公司整体业绩的影响为-2.50亿元至-3.00亿元。2.2021年度，除上述优工业破产清算事项外，公司其他非经常性损益对公司业绩的影响金额为3.00亿元至4.50亿元。主要包括土地收储、公司下属子公司与中电通商、国银租赁签署和解协议等方面。3.2021年度，公司基于谨慎性考虑，除上述事项外，计提各项减值，预估对公司2021年损益的影响金额为-5.00亿元至-6.00亿元。,1
000410.SZ,20220126,20211231,续亏,-38.36,-10.69,-100000.0,-80000.0,-72276.05,20220126,预计净利润-100000~-80000万,1.2021年度，全资子公司优工业破产清算对公司经营性损益影响金额-18.00亿元至-19.00亿元，主要为往来款项减值，对公司非经常性损益影响金额为15.50亿元至16.00亿元，主要为长期股权投资减值、合并报表层面确认的投资收益及计提的预计负债。优工业破产清算事项对公司整体业绩的影响为-2.50亿元至-3.00亿元。2.2021年度，除上述优工业破产清算事项外，公司其他非经常性损益对公司业绩的影响金额为3.00亿元至4.50亿元。主要包括土地收储、公司下属子公司与中电通商、国银租赁签署和解协议等方面。3.2021年度，公司基于谨慎性考虑，除上述事项外，计提各项减值，预估对公司2021年损益的影响金额为-5.00亿元至-6.00亿元。,0
000410.SZ,20211015,20210930,续亏,40.55,49.84,-32000.0,-27000.0,-53825.84,20211015,预计:净利润-32000--27000,报告期内，公司收入规模增加，保持同比减亏态势，经营逐步改善。,1
000410.SZ,20211015,20210930,续亏,40.55,49.84,-32000.0,-27000.0,-53825.84,20211015,预计净利润-32000~-27000万,报告期内，公司收入规模增加，保持同比减亏态势，经营逐步改善。,0
000410.SZ,20210715,20210630,续亏,49.91,55.47,-18000.0,-16000.0,-35932.63,20210715,预计:净利润-18000--16000,"报告期内，公司归属于上市公司股东的净利润为-18,000万元——-16,000万元，同比大幅减亏，公司经营已逐步改善；公司收入规模较上期大幅增长，公司已逐渐步入良性发展轨道.",1
000410.SZ,20210715,20210630,续亏,49.91,55.47,-18000.0,-16000.0,-35932.63,20210715,预计净利润-18000~-16000万,"报告期内，公司归属于上市公司股东的净利润为-18,000万元——-16,000万元，同比大幅减亏，公司经营已逐步改善；公司收入规模较上期大幅增长，公司已逐渐步入良性发展轨道.",0
000410.SZ,20210415,20210331,续亏,47.0,60.0,-12000.0,-9000.0,-22453.5,20210415,预计:净利润-12000--9000,"受司法重整后续影响,公司第一季度净利润仍为负.一季度市场需求旺盛,公司订单大幅增长,亏损规模较上年同期大幅减少,收入规模较上年同期大幅增加.公司逐渐步入良性发展轨道.",1
000410.SZ,20210415,20210331,续亏,47.0,60.0,-12000.0,-9000.0,-22453.5,20210415,预计净利润-12000~-9000万,"受司法重整后续影响,公司第一季度净利润仍为负.一季度市场需求旺盛,公司订单大幅增长,亏损规模较上年同期大幅减少,收入规模较上年同期大幅增加.公司逐渐步入良性发展轨道.",0
000410.SZ,20210126,20201231,续亏,74.57,76.58,-76000.0,-70000.0,-298826.98,20210126,预计净利润-76000~-70000万,"受疫情及2019年司法重整后续影响,公司业务开展受到一定程度的制约,导致经营业绩仍处于亏损状态.公司经历2020年重整后的调整及磨合期,正逐步实现业务全面恢复.",0
000410.SZ,20201015,20200930,续亏,78.47,80.43,-55000.0,-50000.0,-255516.22,20201015,预计净利润-55000~-50000万,2019年公司经营状况严峻，实施了司法重整，各项经营数据不佳。相较于2019年，公司2020年数据同比上升，但由于受疫情及司法重整后续影响，公司业务开展受到一定程度的制约，导致营业收入无法覆盖营业成本总额，经营业绩仍处于亏损状态。由于公司2018、2019年度亏损，根据上市规则，最近两年连续亏损，上市公司被实施退市风险警示（*ST）。如果2020年公司经审计净利润继续为负，公司股票将被暂停上市。公司敬请广大投资者注意投资风险。,0
000410.SZ,20200715,20200630,续亏,71.6333,75.1791,-40000.0,-35000.0,-141010.37,20200715,预计净利润-40000~-35000万,"1,2020年半年度公司受新冠肺炎疫情影响,复工复产后供应链物流受阻,业务开展受到一定程度的制约,导致公司主营业务收入下滑和经营业绩不佳.2,公司2019年度经历了司法重整,目前正处于积极调整,全面恢复阶段.随着疫情的常态化,公司将以现有产品,技术,渠道,品牌为基础,深挖发展潜力.",0
000410.SZ,20200415,20200331,续亏,45.0,56.0,-25000.0,-20000.0,-45364.17,20200415,预计净利润-25000~-20000万,2020年第一季度公司受到新型冠状病毒肺炎疫情影响，为响应国家关于防控疫情工作会议精神，公司复工时间延迟，大部分客户复工延缓，下游需求萎缩和物流受阻等原因影响了公司生产及销售，导致公司一季度营业收入下滑，归属于上市公司股东的净利润为负。3月份以来，随着国内疫情逐步得到控制，公司已逐步恢复到正常经营状态。公司将密切关注疫情进展情况并积极应对，持续加强与客户沟通，推进生产进度，尽量降低疫情对公司生产、经营情况的影响。公司于2019年8月16日被法院裁定受理破产重整，根据《深圳证券交易所股票上市规则》（以下简称“《上市规则》”）13.2.1条第（十一）项规定，被实施退市风险警示（*ST），2019年12月31日公司收到法院裁定，终结了重整程序。公司尚未披露2019年报，由于公司2018年度亏损，2019年预计公司业绩为亏损，根据上市规则，最近两年连续亏损，上市公司将被继续实施退市风险警示（*ST）。公司敬请广大投资者注意投资风险。,0
000410.SZ,20200131,20191231,续亏,-293.27,-217.15,-310000.0,-250000.0,-78826.0,20200131,预计净利润-310000~-250000万,1、受困下游行业不景气及资金紧张等因素，2019年以来公司销售收入下滑明显，盈利能力大幅下降，导致经营性亏损。2、2019年12月31日经沈阳市中级人民法院裁定公司终结重整程序。重整过程中因重整产生的重整损益将计入2019年度相关财务报表，具体数据以经审计的财务报表数据为准。3、公司根据重整及未来发展方向，结合实际经营情况及宏观环境、行业政策的变化，对部分资产计提减值准备。,0
