ts_code,ann_date,end_date,type,p_change_min,p_change_max,net_profit_min,net_profit_max,last_parent_net,first_ann_date,summary,change_reason,update_flag
000513.SZ,20220115,20211231,略增,0.0,10.0,171491.0,188640.0,171491.04,20220115,预计:净利润171491-188640,1、主营业务影响本年度公司化学制剂板块销售增速明显，消化道、促性激素、精神等重点优势领域销售同比实现持续快速增长，加之原料药板块高端特色原料药占比及盈利稳步提升，保障了公司整体业绩的稳步增长。2、非经常性损益的影响2020年公司出售了江苏尼科医疗器械有限公司全部股权，2021年度非经常性损益同比下降。,1
000513.SZ,20220115,20211231,略增,0.0,10.0,171491.0,188640.0,171491.04,20220115,预计净利润171491-188640万,1、主营业务影响本年度公司化学制剂板块销售增速明显，消化道、促性激素、精神等重点优势领域销售同比实现持续快速增长，加之原料药板块高端特色原料药占比及盈利稳步提升，保障了公司整体业绩的稳步增长。2、非经常性损益的影响2020年公司出售了江苏尼科医疗器械有限公司全部股权，2021年度非经常性损益同比下降。,0
000513.SZ,20210126,20201231,略增,25.0,40.0,162859.0,182403.0,130287.54,20210126,预计净利润162859-182403万,"公司2020年度经营业绩与上年同期相比同向上升的主要原因是:1,2020年,公司部分处方药产品因受疫情影响销售未达预期,但由于化学制剂主要产品注射用艾普拉唑钠销售同比上年快速大幅增长,注射用醋酸亮丙瑞林微球,盐酸哌罗匹隆片,马来酸氟伏沙明片销售同比去年实现持续较大增长;中药制剂主要产品抗病毒颗粒受益疫情,销售同比上年大幅增长;加之新型冠状病毒抗体检测试剂产品实现新增销售,为公司整体业绩的稳步增长提供了重要支持.2,收到的政府补助同比增长以及出售江苏尼科医疗器械有限公司股权实现投资收益增加.",0
000513.SZ,20200715,20200630,略增,30.0,40.0,96063.0,103453.0,73894.78,20200715,预计净利润96063-103453万,"公司2020年半年度经营业绩与上年同期相比同向上升的主要原因是:1,出售江苏尼科医疗器械有限公司股权增加了公司归属于母公司的净利润约为人民币8,523.99万元;2,2020年上半年,受新型冠状病毒肺炎疫情影响,公司处方药相关产品销售虽未达预期,但由于抗病毒颗粒及注射用艾普拉唑钠同比去年上半年大幅增长,加之新型冠状病毒抗体检测试剂产品实现新增销售,为公司整体业绩增长提供了重要支持.",0
000513.SZ,20200110,20191231,略增,15.0,25.0,124450.0,135272.0,108217.49,20200110,预计净利润124450-135272万,公司2019年度经营业绩与上年同期相比同向上升的主要原因是：公司不断深化营销体制改革，实行精细化管理，化学制剂业务板块盈利增长较上年明显加快；由于高端特色原料药业务的快速增长以及工艺提升带来的成本下降，原料药业务板块盈利大幅增长。,0
