ts_code,ann_date,end_date,type,p_change_min,p_change_max,net_profit_min,net_profit_max,last_parent_net,first_ann_date,summary,change_reason,update_flag
000509.SZ,20260131,20251231,续亏,-29.1953,35.4024,-1800.0,-900.0,-1393.24,20260131,预计:净利润-1800--900,报告期内，公司预计归属于上市公司股东的净利润为亏损900万-1800万，主要原因为公司受全球消费市场环境低迷影响，市场端承压，市场需求释放不足，直接影响公司业务的拓展及收入增长，导致报告期利润亏损。,1
000509.SZ,20260131,20251231,续亏,-29.1953,35.4024,-1800.0,-900.0,-1393.24,20260131,预计:净利润-1800--900,报告期内，公司预计归属于上市公司股东的净利润为亏损900万-1800万，主要原因为公司受全球消费市场环境低迷影响，市场端承压，市场需求释放不足，直接影响公司业务的拓展及收入增长，导致报告期利润亏损。,0
000509.SZ,20250715,20250630,首亏,-317.6752,-245.1168,-300.0,-200.0,137.82,20250715,预计:净利润-300--200,公司2025年半年度亏损的主要原因系子公司天玑智谷（湖北）信息技术有限公司受国际贸易政策的影响，海外市场销售规模下滑，叠加市场竞争不断加剧，导致整体毛利率水平有所下降；同时，受美元汇率波动影响，公司汇兑收益较上年同期有所下降。,0
000509.SZ,20250125,20241231,首亏,-242.6703,-171.3352,-1800.0,-900.0,1261.65,20250125,预计净利润-1800~-900万,"公司预计2024年度营业收入较上年同期增长，归属于上市公司股东的净利润亏损。营业收入较上年同期增长主要原因系子公司天玑智谷（湖北）信息技术有限公司业务拓展增加收入所致；归属于上市公司股东的净利润较上年同期下降主要原因系上年公司完成南充土地收储事宜确认收益4,243.88万元，该项目属于非经常性损益，本报告期无相关收益；扣除非经常性损益后的净利润较上年同期亏损减少主要原因系公司报告期内资产减值及信用减值损失较上年同期减少，同时公司采取多项措施降本增效，严格控制了成本费用。",1
000509.SZ,20250125,20241231,首亏,-242.6703,-171.3352,-1800.0,-900.0,1261.65,20250125,预计:净利润-1800--900,"公司预计2024年度营业收入较上年同期增长，归属于上市公司股东的净利润亏损。营业收入较上年同期增长主要原因系子公司天玑智谷（湖北）信息技术有限公司业务拓展增加收入所致；归属于上市公司股东的净利润较上年同期下降主要原因系上年公司完成南充土地收储事宜确认收益4,243.88万元，该项目属于非经常性损益，本报告期无相关收益；扣除非经常性损益后的净利润较上年同期亏损减少主要原因系公司报告期内资产减值及信用减值损失较上年同期减少，同时公司采取多项措施降本增效，严格控制了成本费用。",0
000509.SZ,20240710,20240630,预减,-96.78,-95.17,110.0,165.0,3416.56,20240710,预计:净利润110-165,"公司业绩变动主要源于上年同期南充土地收储产生4,293.88万元收益，本报告期无相关收益，该项目属于非经常性损益；公司子公司天玑智谷经营业绩较上年同期有所提升等。",1
000509.SZ,20240710,20240630,预减,-96.78,-95.17,110.0,165.0,3416.56,20240710,预计:净利润110-165,"公司业绩变动主要源于上年同期南充土地收储产生4,293.88万元收益，本报告期无相关收益，该项目属于非经常性损益；公司子公司天玑智谷经营业绩较上年同期有所提升等。",0
000509.SZ,20240131,20231231,扭亏,461.8076,642.7114,1000.0,1500.0,-276.39,20240131,预计:净利润1000-1500,"公司业绩变动主要源于2023年度南充土地收储产生约4,200万元收益，该项目属于非经常性损益；公司子公司天玑智谷扩大融资规模利息费用增加；公司苗木、往来款等资产计提减值损失增加等。",1
000509.SZ,20240131,20231231,扭亏,461.8076,642.7114,1000.0,1500.0,-276.39,20240131,预计:净利润1000-1500,"公司业绩变动主要源于2023年度南充土地收储产生约4,200万元收益，该项目属于非经常性损益；公司子公司天玑智谷扩大融资规模利息费用增加；公司苗木、往来款等资产计提减值损失增加等。",0
000509.SZ,20230131,20221231,续亏,29.14,64.57,-400.0,-200.0,-564.51,20230131,预计:净利润-400--200,公司业绩变动主要源于子公司经营业绩增加所致。,1
000509.SZ,20230131,20221231,续亏,29.14,64.57,-400.0,-200.0,-564.51,20230131,预计净利润-400~-200万,公司业绩变动主要源于子公司经营业绩增加所致。,0
000509.SZ,20211225,20211231,首亏,-179.37,-152.91,-600.0,-400.0,755.99,20211225,预计:净利润-600--400,公司业绩变动的主要原因如下：公司本报告期与上年同期相比，归属于上市公司股东的净利润由盈利转为亏损。其主要原因是受疫情持续影响，公司会展服务板块亏损增加所致。,1
000509.SZ,20211225,20211231,首亏,-179.37,-152.91,-600.0,-400.0,755.99,20211225,预计净利润-600~-400万,公司业绩变动的主要原因如下：公司本报告期与上年同期相比，归属于上市公司股东的净利润由盈利转为亏损。其主要原因是受疫情持续影响，公司会展服务板块亏损增加所致。,0
000509.SZ,20211015,20210930,扭亏,110.25,113.1,180.0,230.0,-1756.36,20211015,预计:净利润180-230,"本报告期内，公司全资子公司成都康达瑞信企业管理有限公司以支付现金方式购买深圳天润达科技发展有限公司持有的天玑智谷（湖北）信息技术有限公司51%股权项目于2021年9月28日完成资产过户及相关工商变更登记手续。公司2021年前三季度较上年同期扭亏为盈，主要原因是本报告期内因司法执行处置投资性房地产，实现非经常性收益约1,700万元。公司2021年第三季度因实施上述重大资产重组，期间费用较上年同期有所增加，预计7-9月亏损910.40万元-860.40万元。",1
000509.SZ,20211015,20210930,扭亏,110.25,113.1,180.0,230.0,-1756.36,20211015,预计净利润180-230万,"本报告期内，公司全资子公司成都康达瑞信企业管理有限公司以支付现金方式购买深圳天润达科技发展有限公司持有的天玑智谷（湖北）信息技术有限公司51%股权项目于2021年9月28日完成资产过户及相关工商变更登记手续。公司2021年前三季度较上年同期扭亏为盈，主要原因是本报告期内因司法执行处置投资性房地产，实现非经常性收益约1,700万元。公司2021年第三季度因实施上述重大资产重组，期间费用较上年同期有所增加，预计7-9月亏损910.40万元-860.40万元。",0
000509.SZ,20210715,20210630,扭亏,229.8008,273.0678,900.0,1200.0,-693.37,20210715,预计:净利润900-1200,"本报告期较上年同期扭亏为盈，主要原因是本报告期内因司法执行处置投资性房地产，实现非经常性收益约1,500万元。",1
000509.SZ,20210715,20210630,扭亏,229.8008,273.0678,900.0,1200.0,-693.37,20210715,预计净利润900-1200万,"本报告期较上年同期扭亏为盈，主要原因是本报告期内因司法执行处置投资性房地产，实现非经常性收益约1,500万元。",0
000509.SZ,20210415,20210331,扭亏,270.1608,312.701,1200.0,1500.0,-705.22,20210415,预计:净利润1200-1500,"本报告期较上年同期扭亏为盈,主要原因是本报告期内因司法执行处置投资性房地产,实现非经常性收益约1,500万元.",1
000509.SZ,20210415,20210331,扭亏,270.1608,312.701,1200.0,1500.0,-705.22,20210415,预计净利润1200-1500万,"本报告期较上年同期扭亏为盈,主要原因是本报告期内因司法执行处置投资性房地产,实现非经常性收益约1,500万元.",0
000509.SZ,20210130,20201231,扭亏,105.4056,107.7222,700.0,1000.0,-12949.6,20210130,预计净利润700-1000万,"本报告期较上年同期亏损减少的主要原因是本报告期非经常性损益中依据法院判决冲回已计提的债务利息以及通过债务和解实现债务重组收益,两项合计约5,945万元.",0
000509.SZ,20201015,20200930,首亏,-328.2337,-292.1968,-1900.0,-1600.0,832.48,20201015,预计净利润-1900~-1600万,本报告期公司主营业务受新冠疫情影响较大，营业收入较上年同期有所减少。而归属于上市公司股东的净利润较上年同期相比亏损较大，其主要原因是公司报告期内对德瑞系列诉讼等案件预计非经常性损失。,0
000509.SZ,20200715,20200630,续亏,4.4713,22.3829,-800.0,-650.0,-837.44,20200715,预计净利润-800~-650万,"本报告期公司主营业务受新冠疫情影响,经营性亏损较上年同期有所增加.而归属于上市公司股东的净利润较上年同期亏损有所减少,其主要原因是公司依据四川省成都市中级人民法院(2019)川01民初3688号《民事判决书》对德瑞系诉讼冲回利息1,425.55万元,并由此形成非经常性损益收入.",0
000509.SZ,20200415,20200331,续亏,-165.2798,-112.2239,-750.0,-600.0,-282.72,20200415,预计净利润-750~-600万,本报告期亏损较上年同期增加，主要原因是公司开展的医疗服务业务和会展服务业务受到新冠疫情影响，导致业务收入和净利润大幅降低，以及公司就相关诉讼事项计提利息。,0
000509.SZ,20200121,20191231,续亏,-160.6062,-86.1473,-14000.0,-10000.0,-5372.09,20200121,预计净利润-14000~-10000万,"公司去年同期亏损5,372.09万元，本报告期预计亏损10,000.00万元至14,000.00万元。业绩变动主要原因如下：1、根据四川省高级人民法院就公司与兴源环亚集团有限公司合同纠纷一案作出的《民事判决书》（[2019]川民终946号），公司计提非经常性损益支出“政府收储土地补偿款和赔偿款”及相应利息，导致本期亏损约8,000.00万元，最终计提金额以经审计的年度报告为准；2、公司将对上海友备石油化工有限公司的应收账款单独进行减值测试，计提减值准备形成非经常性损益，预计将导致本期亏损约4,624.32万元。",0
