ts_code,ann_date,end_date,type,p_change_min,p_change_max,net_profit_min,net_profit_max,last_parent_net,first_ann_date,summary,change_reason,update_flag
000695.SZ,20260120,20251231,续亏,-248.3305,-145.2531,-9800.0,-6900.0,-2813.42,20260117,预计:净利润-9800--6900,1、因工作人员将财务数据转录至公告编制系统时校对不严谨，导致前次业绩预告中基本每股收益数据错误，特此更正。2、本次业绩预告修正对归属于上市公司股东的净利润、扣除非经常性损益后的净利润均无影响。,0
000695.SZ,20260117,20251231,续亏,-248.3305,-145.2531,-9800.0,-6900.0,-2813.42,20260117,预计:净利润-9800--6900,1.公司负极材料产能总体规模尚小，尚未充分放量，固定资产折旧、人工成本相对较高，叠加上游石油焦、煅后焦等原辅料价格上涨，导致本年度毛利率下降；2.公司全面进入新能源负极材料行业时间尚短，产线建设及铺底流动资金主要来源于负债，报告期内财务费用较高；3.报告期内，公司包头子公司晶硅光伏业务建设项目未予推进，出于谨慎性考虑，对相关在建工程项目计提减值准备。,1
000695.SZ,20260117,20251231,续亏,-248.3305,-145.2531,-9800.0,-6900.0,-2813.42,20260117,预计:净利润-9800--6900,1.公司负极材料产能总体规模尚小，尚未充分放量，固定资产折旧、人工成本相对较高，叠加上游石油焦、煅后焦等原辅料价格上涨，导致本年度毛利率下降；2.公司全面进入新能源负极材料行业时间尚短，产线建设及铺底流动资金主要来源于负债，报告期内财务费用较高；3.报告期内，公司包头子公司晶硅光伏业务建设项目未予推进，出于谨慎性考虑，对相关在建工程项目计提减值准备。,0
000695.SZ,20250712,20250630,首亏,-2562.7431,-2057.565,-3900.0,-3100.0,158.36,20250712,预计:净利润-3900--3100,1.报告期内，上游石油焦、煅后焦等原辅料价格出现上涨，公司负极材料的出货价格稳定，毛利率相对降低。2.公司全面进入新能源负极材料行业时间尚短，报告期内，负极材料出货量总体规模尚小，固定资产折旧、人工成本相对较高，导致利润减少。,0
000695.SZ,20250119,20241231,续亏,-60.1414,-21.4866,-2900.0,-2200.0,-1810.9,20250119,预计:净利润-2900--2200,1.报告期内，公司负极材料业务研发投入增加，客户开发及产品研发的经济效益尚未显现。2.2024年下半年，上游石油焦、煅后焦等原辅料价格出现上涨，公司负极材料的出货价格变化不大，阶段性出现亏损。3.报告期内，负极材料出货量总体规模尚小，固定资产折旧、人工成本相对较高，导致利润减少。,0
000695.SZ,20240713,20240630,扭亏,117.3279,125.671,135.0,200.0,-779.09,20240713,预计:净利润135-200,本报告期公司业绩变动的主要原因：1.与去年同期相比，已经剥离了亏损严重的包装物印刷业务，亏损减少；2.负极材料业务客户拓展取得成效，自建石墨化产能投用，业务规模扩大，盈利能力有所提高。,1
000695.SZ,20240713,20240630,扭亏,117.3279,125.671,135.0,200.0,-779.09,20240713,预计:净利润135-200,本报告期公司业绩变动的主要原因：1.与去年同期相比，已经剥离了亏损严重的包装物印刷业务，亏损减少；2.负极材料业务客户拓展取得成效，自建石墨化产能投用，业务规模扩大，盈利能力有所提高。,0
000695.SZ,20240131,20231231,续亏,-42.0724,-0.5435,-1950.0,-1380.0,-1372.54,20240131,预计:净利润-1950--1380,公司2023年出售包装印刷业务，并布局新能源业务，整体经营情况较2022年已持续大幅减亏，具体情况说明如下：1.2023年3月31日，公司剥离亏损严重的包装物印刷业务，大幅减亏；2.新能源业务中，负极材料项目部分产能于第四季度陆续投产调试。报告期内，预计负极材料业务营业收入规模与印刷业务相当，并实现盈利，但尚不足以弥补印刷业务产生的亏损。公司将有序推进新能源负极材料等储备项目的前期手续办理、建设进度，加大客户开拓，逐步提高公司盈利能力。,1
000695.SZ,20240131,20231231,续亏,-42.0724,-0.5435,-1950.0,-1380.0,-1372.54,20240131,预计:净利润-1950--1380,公司2023年出售包装印刷业务，并布局新能源业务，整体经营情况较2022年已持续大幅减亏，具体情况说明如下：1.2023年3月31日，公司剥离亏损严重的包装物印刷业务，大幅减亏；2.新能源业务中，负极材料项目部分产能于第四季度陆续投产调试。报告期内，预计负极材料业务营业收入规模与印刷业务相当，并实现盈利，但尚不足以弥补印刷业务产生的亏损。公司将有序推进新能源负极材料等储备项目的前期手续办理、建设进度，加大客户开拓，逐步提高公司盈利能力。,0
000695.SZ,20230131,20221231,续亏,-84.3515,-42.214,-10500.0,-8100.0,-5695.64,20230131,预计:净利润-10500--8100,公司收入下降、利润减少的主要原因：1.因疫情影响，客户订单减少，收入下降；2.出于谨慎性原则，预计对部分客户应收账款单项计提坏账准备增加。,1
000695.SZ,20220715,20220630,续亏,-139.1023,-59.4016,-4200.0,-2800.0,-1756.57,20220715,预计:净利润-4200--2800,公司收入下降、成本上升、利润减少的主要原因如下：1.受疫情影响，客户订单减少、物流成本提高；2.上游原辅料价格上涨，公司主动放弃毛利润较低的部分订单；3.收入减少，生产设备折旧、房租、人工费等固定成本仍较高，使得成本相对上升，导致利润下降。,1
000695.SZ,20220715,20220630,续亏,-139.1023,-59.4016,-4200.0,-2800.0,-1756.57,20220715,预计净利润-4200~-2800万,公司收入下降、成本上升、利润减少的主要原因如下：1.受疫情影响，客户订单减少、物流成本提高；2.上游原辅料价格上涨，公司主动放弃毛利润较低的部分订单；3.收入减少，生产设备折旧、房租、人工费等固定成本仍较高，使得成本相对上升，导致利润下降。,0
000695.SZ,20220129,20211231,续亏,-263.2797,-130.0771,-6000.0,-3800.0,-1651.62,20220129,预计:净利润-6000--3800,控股子公司天津海顺印业包装有限公司2021年收入下降明显，成本处于持续上升趋势。主要原因为上游供应商持续暴涨的原辅料价格，使得海顺印业放弃了部分大客户订单。同时海顺印业生产设备折旧、房租、人工费等固定成本基数增加，使得成本持续上升。2021年收入下降，原材料、制造费用及人工成本的上升是造成2021年利润下降的主要原因。,1
000695.SZ,20220129,20211231,续亏,-263.2797,-130.0771,-6000.0,-3800.0,-1651.62,20220129,预计净利润-6000~-3800万,控股子公司天津海顺印业包装有限公司2021年收入下降明显，成本处于持续上升趋势。主要原因为上游供应商持续暴涨的原辅料价格，使得海顺印业放弃了部分大客户订单。同时海顺印业生产设备折旧、房租、人工费等固定成本基数增加，使得成本持续上升。2021年收入下降，原材料、制造费用及人工成本的上升是造成2021年利润下降的主要原因。,0
000695.SZ,20211015,20210930,续亏,-203.05,-51.56,-3903.0,-1952.0,-1287.9,20211015,预计:净利润-3903--1952,1、纸张等主要原材料价格上涨；2、投资生产设备的相关支出在2020年度开始集中释放，导致制造费用-折旧增加，生产成本上升；3、受疫情影响，劳动力不足，人工成本增加。,1
000695.SZ,20211015,20210930,续亏,-203.05,-51.56,-3903.0,-1952.0,-1287.9,20211015,预计净利润-3903~-1952万,1、纸张等主要原材料价格上涨；2、投资生产设备的相关支出在2020年度开始集中释放，导致制造费用-折旧增加，生产成本上升；3、受疫情影响，劳动力不足，人工成本增加。,0
000695.SZ,20210715,20210630,续亏,-73.6169,-15.7446,-2100.0,-1400.0,-1209.56,20210715,预计:净利润-2100--1400,受原材料价格上涨，以及之前投资的生产设备集中投产，导致折旧增加的影响，预计2021年半年度业绩亏损。,1
000695.SZ,20210715,20210630,续亏,-73.6169,-15.7446,-2100.0,-1400.0,-1209.56,20210715,预计净利润-2100~-1400万,受原材料价格上涨，以及之前投资的生产设备集中投产，导致折旧增加的影响，预计2021年半年度业绩亏损。,0
000695.SZ,20210415,20210331,续亏,-16.3547,22.4302,-900.0,-600.0,-773.5,20210415,预计:净利润-900--600,受原材料价格上涨，订单销售价格未同步上涨以及固定成本增加，融资成本上升的影响，预计2021年第一季度业绩亏损。,1
000695.SZ,20210415,20210331,续亏,-16.3547,22.4302,-900.0,-600.0,-773.5,20210415,预计净利润-900~-600万,受原材料价格上涨，订单销售价格未同步上涨以及固定成本增加，融资成本上升的影响，预计2021年第一季度业绩亏损。,0
000695.SZ,20210130,20201231,首亏,-220.0341,-160.017,-1600.0,-800.0,1332.95,20210130,预计净利润-1600~-800万,"造成公司2020年亏损的主要原因有:1,公司重要控股子公司天津海顺印业包装有限公司(以下简称“海顺印业”)因新冠疫情受到上游餐饮及食品包装的传导效应影响,客户订单减少,导致营业收入下降.同时,为保证正常生产经营,降低疫情给职工和公司带来的不利影响,人工成本支出并未减少.2,原材料(纸张)价格提升幅度较大.3,海顺印业前期投入的生产线智能化改造已完工,产生的固定折旧费用集中释放,其产生的融资费用在今年也有一定增长.",0
000695.SZ,20201015,20200930,首亏,-347.5,-270.16,-1600.0,-1100.0,646.46,20201015,预计净利润-1600~-1100万,公司重要控股子公司天津海顺印业包装有限公司因新冠疫情受到上游餐饮及食品包装的传导效应影响，客户订单萎缩，叠加原材料价格提升等外部因素影响，预计2020年前三季度业绩亏损。,0
000695.SZ,20200715,20200630,首亏,-690.86,-493.91,-1650.0,-1100.0,279.25,20200715,预计净利润-1650~-1100万,"公司重要控股子公司天津海顺印业包装有限公司处于快消品的下游,因新冠疫情,受到上游餐饮及食品包装的传导效应影响,订单减少,预计2020年半年度业绩亏损.",0
000695.SZ,20200415,20200331,首亏,-950.56,-525.28,-1100.0,-550.0,129.33,20200415,预计净利润-1100~-550万,因今年一季度新冠疫情蔓延，公司在原材料采购、人员复工、产品销售等方面受到了较大影响，预计2020年第一季度业绩亏损。,0
000695.SZ,20200122,20191231,预减,-74.26,-61.38,940.0,1410.0,3651.43,20200122,预计净利润940-1410万,"2018年公司完成重大资产重组，2019年度业绩不再包含热电业务。同时重大资产重组的投资收益85,365,918.38元计入2018年财务报告中，为非经常性损益，今年无此项收益。预计公司2019年度业绩比去年同期业绩同向下降。",0
