ts_code,ann_date,end_date,type,p_change_min,p_change_max,net_profit_min,net_profit_max,last_parent_net,first_ann_date,summary,change_reason,update_flag
000790.SZ,20260131,20251231,续亏,-4832.588,-3935.7538,-33000.0,-27000.0,-669.02,20260124,预计:净利润-33000--27000,公司2025年度业绩预计出现较大幅度亏损，主要系：（1）经营业绩下滑：公司核心药品受挂网价格下调影响，收入及毛利下降；公司持续缩减钢结构业务致使产值确认和利润贡献下降；公司新投建的山东凌凯项目报告期内转固折旧摊销费用增加，未实现预期收益导致经营亏损扩大。（2）处置子公司西藏康域股权产生处置损失。（3）山东、海南及部分子公司长期资产减值：山东凌凯项目因市场环境变化及技术迭代等因素影响，项目收益未达预期，商誉及相关资产组计提减值准备；海南长期资产受市场下行影响存在减值迹象，计提减值准备；部分并购子公司商誉计提减值准备。本次计提资产减值准备情况未经会计师事务所审计，计提资产减值准备的相关评估工作正在进行中，最终数据以会计师事务所审计及评估机构的评估结果为准。,1
000790.SZ,20260131,20251231,续亏,-4832.588,-3935.7538,-33000.0,-27000.0,-669.02,20260124,预计:净利润-33000--27000,公司2025年度业绩预计出现较大幅度亏损，主要系：（1）经营业绩下滑：公司核心药品受挂网价格下调影响，收入及毛利下降；公司持续缩减钢结构业务致使产值确认和利润贡献下降；公司新投建的山东凌凯项目报告期内转固折旧摊销费用增加，未实现预期收益导致经营亏损扩大。（2）处置子公司西藏康域股权产生处置损失。（3）山东、海南及部分子公司长期资产减值：山东凌凯项目因市场环境变化及技术迭代等因素影响，项目收益未达预期，商誉及相关资产组计提减值准备；海南长期资产受市场下行影响存在减值迹象，计提减值准备；部分并购子公司商誉计提减值准备。本次计提资产减值准备情况未经会计师事务所审计，计提资产减值准备的相关评估工作正在进行中，最终数据以会计师事务所审计及评估机构的评估结果为准。,0
000790.SZ,20260124,20251231,续亏,,,,,-669.0166,20260124,续亏,受公司战略调整实施、核心产品挂网价格下调及资产减值等多种因素综合影响，预计公司2025年年度亏损幅度较2025年前三季度进一步扩大。,1
000790.SZ,20260124,20251231,续亏,,,,,-669.0166,20260124,续亏,受公司战略调整实施、核心产品挂网价格下调及资产减值等多种因素综合影响，预计公司2025年年度亏损幅度较2025年前三季度进一步扩大。,0
000790.SZ,20250712,20250630,首亏,-703.7322,-593.9627,-5500.0,-4500.0,911.0,20250712,预计:净利润-5500--4500,2025年，公司主营产品三七通舒胶囊中选全国第三批中成药集采，成本费用的刚性需求导致利润贡献下滑。为优化资源配置，聚焦主业发展，公司主动缩减建筑钢结构业务规模，致该业务产值及利润贡献较去年同期降低。山东凌凯试生产费用及折旧摊销增加。,0
000790.SZ,20250122,20241231,首亏,-156.0386,-128.9232,-1550.0,-800.0,2765.95,20250122,预计:净利润-1550--800,2024年，公司围绕“高质量发展新征程”主题，锚定年度经营目标，坚定聚焦医药主业，医药业务营业收入较去年增长，但由于市场竞争激烈，中药原材料采购价格持续攀升，致使整体毛利率呈下滑态势。与此同时，受建筑钢结构业务规模主动缩减、山东凌凯试生产费用及折旧摊销增加，以及计提商誉减值等多重因素影响，公司整体净利润由盈转亏。以下为影响公司2024年度经营业绩的主要因素：1.报告期内，建筑钢结构板块聚焦优质项目，精简承接范围，导致该板块产值和利润确认较去年大幅减少；2.报告期内，山东凌凯在建项目尚处于试生产调试阶段，未实现产品销售，产生折旧摊销费用；3.报告期内，初步经评估需确认商誉减值，并据此计提了相应的商誉减值准备。此外，本次计提资产减值准备情况未经会计师事务所审计，计提资产减值准备的相关评估工作正在进行中，最终数据以会计师事务所审计及评估机构的评估结果为准。,0
000790.SZ,20220126,20211231,预增,70.65,97.31,6400.0,7400.0,3750.35,20220126,预计:净利润6400-7400,三、业绩变动原因说明2021年，公司持续优化和完善经营管理机制，强化激励考核，调动员工积极性，积极加强市场销售，优化营销团队，深入拓展资源，调整产品结构，推动业务发展，实现营业收入稳步增长，同时加强成本及费用管控，挖潜增效，提升运营效率，实现利润快速增长。,1
000790.SZ,20220126,20211231,预增,70.65,97.31,6400.0,7400.0,3750.35,20220126,预计净利润6400-7400万,三、业绩变动原因说明2021年，公司持续优化和完善经营管理机制，强化激励考核，调动员工积极性，积极加强市场销售，优化营销团队，深入拓展资源，调整产品结构，推动业务发展，实现营业收入稳步增长，同时加强成本及费用管控，挖潜增效，提升运营效率，实现利润快速增长。,0
000790.SZ,20200110,20191231,预增,92.5,118.16,6000.0,6800.0,3116.94,20200110,预计净利润6000-6800万,本报告期公司持续加强市场拓展及项目承接力度，销售规模同比增长，营业利润同比增长。,0
