ts_code,ann_date,end_date,type,p_change_min,p_change_max,net_profit_min,net_profit_max,last_parent_net,first_ann_date,summary,change_reason,update_flag
000807.SZ,20250709,20250630,略增,7.19,11.16,270000.0,280000.0,251884.8319,20250709,预计:净利润270000-280000,报告期内，云南铝业股份有限公司（以下简称“云铝股份”或“公司”）电解铝生产线满负荷生产，公司抓实全要素对标和降本增效各项工作，抓住铝价上涨的市场机遇，持续加大营销力度，公司铝商品产销量同比增加，经营业绩同比实现增长。尤其是今年二季度受益于氧化铝等原材料价格回落，公司二季度经营业绩环比实现大幅增长。,0
000807.SZ,20241015,20240930,预增,51.7,53.69,380000.0,385000.0,250499.1937,20241015,预计:净利润380000-385000,报告期内，云南铝业股份有限公司（以下简称“云铝股份”或“公司”）加快电解铝产能的复产进度，电解铝产能利用率大幅提升，在三季度实现满负荷生产，同时公司抓实全要素对标和降本增效各项工作，持续加大营销力度，公司铝商品产销量同比较大幅度增长，经营业绩同比增加。,0
000807.SZ,20240711,20240630,预增,58.42,71.62,240000.0,260000.0,151496.349,20240711,预计:净利润240000-260000,报告期内，云南铝业股份有限公司（以下简称“云铝股份”或“公司”）加强与电力管理部门沟通，积极争取用电负荷，加快电解铝产能的复产进度，实现电解铝产能负荷率的大幅提升；同时紧紧抓住铝价上涨的市场机遇，持续加大营销力度，积极开拓市场，公司铝产品的产销量同比大幅增长，经营业绩同比实现增长。,1
000807.SZ,20240711,20240630,预增,58.42,71.62,240000.0,260000.0,151496.349,20240711,预计:净利润240000-260000,报告期内，云南铝业股份有限公司（以下简称“云铝股份”或“公司”）加强与电力管理部门沟通，积极争取用电负荷，加快电解铝产能的复产进度，实现电解铝产能负荷率的大幅提升；同时紧紧抓住铝价上涨的市场机遇，持续加大营销力度，积极开拓市场，公司铝产品的产销量同比大幅增长，经营业绩同比实现增长。,0
000807.SZ,20220415,20220331,预增,59.83,74.79,109000.0,119200.0,68197.2175,20220415,预计:净利润109000-119200,报告期内，云南铝业股份有限公司（以下简称“云铝股份”或“公司”）经营业绩实现同比增长的主要原因如下：一是公司紧抓铝价上涨的市场机遇，积极开拓市场，实现及时销售；二是公司充分利用云南省电力供应情况逐步好转的形势，全力推进电解铝复产及新项目投产工作；三是进一步抓实全要素对标，严格控制各项成本费用。,1
000807.SZ,20220415,20220331,预增,59.83,74.79,109000.0,119200.0,68197.2175,20220415,预计净利润109000-119200万,报告期内，云南铝业股份有限公司（以下简称“云铝股份”或“公司”）经营业绩实现同比增长的主要原因如下：一是公司紧抓铝价上涨的市场机遇，积极开拓市场，实现及时销售；二是公司充分利用云南省电力供应情况逐步好转的形势，全力推进电解铝复产及新项目投产工作；三是进一步抓实全要素对标，严格控制各项成本费用。,0
000807.SZ,20220128,20211231,预增,263.41,276.71,328000.0,340000.0,90255.5209,20220128,预计:净利润328000-340000,报告期内，主要因铝商品价格同比2020年上涨，公司2021年经营业绩同比实现增长。但公司限电减产程度严重，2021年9月以后，受“能耗双控”和全资子公司云南文山铝业有限公司11月18日电解六区1628号电解槽漏槽等影响，四季度铝商品产销量下降，导致全年铝商品产销量未完成年初制定目标；加之四季度以来氧化铝、阳极炭块、石油焦等大宗原辅材料价格上涨，国家和地方政府取消电解铝行业优惠电价，以及“能耗双控”停槽降负荷增加修理费用等，导致公司电解铝完全成本有较大幅度上升。虽然公司通过优化工艺控制，调整生产组织，实施全要素对标、降本增效和节能减排等积极应对，但仍对公司生产经营产生了不利影响。此外，本业绩预告已考虑公司拟计提资产减值对公司报告期业绩的影响（主要因国家发改委于2021年8月印发了《国家发展改革委关于完善电解铝行业阶梯电价政策的通知》，为应对用电成本上升，对存量电解铝等资产进行了排查和评估，对老旧、不符合未来节能降耗需要的机器设备等制定了改造、清理或处置计划，并相应进行了减值测试，最终结果由具备证券期货从业资格的评估机构及审计机构进行评估和审计后确定）。,1
000807.SZ,20220128,20211231,预增,263.41,276.71,328000.0,340000.0,90255.5209,20220128,预计净利润328000-340000万,报告期内，主要因铝商品价格同比2020年上涨，公司2021年经营业绩同比实现增长。但公司限电减产程度严重，2021年9月以后，受“能耗双控”和全资子公司云南文山铝业有限公司11月18日电解六区1628号电解槽漏槽等影响，四季度铝商品产销量下降，导致全年铝商品产销量未完成年初制定目标；加之四季度以来氧化铝、阳极炭块、石油焦等大宗原辅材料价格上涨，国家和地方政府取消电解铝行业优惠电价，以及“能耗双控”停槽降负荷增加修理费用等，导致公司电解铝完全成本有较大幅度上升。虽然公司通过优化工艺控制，调整生产组织，实施全要素对标、降本增效和节能减排等积极应对，但仍对公司生产经营产生了不利影响。此外，本业绩预告已考虑公司拟计提资产减值对公司报告期业绩的影响（主要因国家发改委于2021年8月印发了《国家发展改革委关于完善电解铝行业阶梯电价政策的通知》，为应对用电成本上升，对存量电解铝等资产进行了排查和评估，对老旧、不符合未来节能降耗需要的机器设备等制定了改造、清理或处置计划，并相应进行了减值测试，最终结果由具备证券期货从业资格的评估机构及审计机构进行评估和审计后确定）。,0
000807.SZ,20211015,20210930,预增,426.04,469.88,300000.0,325000.0,57029.6313,20211015,预计:净利润300000-325000,2021年1-9月，因主要受铝价上涨的影响，导致云南铝业股份有限公司（以下简称“云铝股份”或“公司”）业绩同比实现增长。报告期内，虽然铝产品消费需求旺盛、价格持续上涨，但公司所在区域限电减产程度加剧，加之原材料、能源价格大幅上涨，公司虽通过优化工艺控制，调整生产组织，实施全要素对标、降本增效和节能减排等工作，持续加大营销力度，积极开拓市场，但2021年第三季度铝商品产销量仍环比下降，未完成年初制定的产销计划。,1
000807.SZ,20211015,20210930,预增,426.04,469.88,300000.0,325000.0,57029.6313,20211015,预计净利润300000-325000万,2021年1-9月，因主要受铝价上涨的影响，导致云南铝业股份有限公司（以下简称“云铝股份”或“公司”）业绩同比实现增长。报告期内，虽然铝产品消费需求旺盛、价格持续上涨，但公司所在区域限电减产程度加剧，加之原材料、能源价格大幅上涨，公司虽通过优化工艺控制，调整生产组织，实施全要素对标、降本增效和节能减排等工作，持续加大营销力度，积极开拓市场，但2021年第三季度铝商品产销量仍环比下降，未完成年初制定的产销计划。,0
000807.SZ,20210715,20210630,预增,640.0,722.0,180000.0,200000.0,24327.9561,20210715,预计:净利润180000-200000,报告期内，国内宏观经济形势稳定向好，铝产品消费需求旺盛，铝产品价格持续上涨，云南铝业股份有限公司（以下简称“云铝股份”或“公司”）紧紧抓住市场机遇，抓实全要素对标和降本增效各项工作；加快实施“合金化”战略，产品结构不断优化，合金化率持续提高；全力抓好重点项目达产达标，持续加大营销力度，积极开拓市场，铝商品产销量增幅较大，报告期公司经营业绩同比实现增长。,1
000807.SZ,20210715,20210630,预增,640.0,722.0,180000.0,200000.0,24327.9561,20210715,预计净利润180000-200000万,报告期内，国内宏观经济形势稳定向好，铝产品消费需求旺盛，铝产品价格持续上涨，云南铝业股份有限公司（以下简称“云铝股份”或“公司”）紧紧抓住市场机遇，抓实全要素对标和降本增效各项工作；加快实施“合金化”战略，产品结构不断优化，合金化率持续提高；全力抓好重点项目达产达标，持续加大营销力度，积极开拓市场，铝商品产销量增幅较大，报告期公司经营业绩同比实现增长。,0
000807.SZ,20210415,20210331,预增,276.0,276.0,68000.0,68000.0,18096.1089,20210415,预计:净利润68000,"报告期内,云南铝业股份有限公司(以下简称“云铝股份”或“公司”)紧紧抓住宏观经济和铝市场回升的机遇,抓实全要素对标,不断提升公司各产品成本竞争力;加快实施“合金化”战略,产品结构不断优化,合金化率持续提高;全力抓好新项目达产达标,积极开拓市场,公司铝商品产销量实现较大幅度增加,报告期公司经营业绩同比实现较大增长.",1
000807.SZ,20210415,20210331,预增,276.0,276.0,68000.0,68000.0,18096.1089,20210415,预计净利润68000万,"报告期内,云南铝业股份有限公司(以下简称“云铝股份”或“公司”)紧紧抓住宏观经济和铝市场回升的机遇,抓实全要素对标,不断提升公司各产品成本竞争力;加快实施“合金化”战略,产品结构不断优化,合金化率持续提高;全力抓好新项目达产达标,积极开拓市场,公司铝商品产销量实现较大幅度增加,报告期公司经营业绩同比实现较大增长.",0
000807.SZ,20210130,20201231,预增,80.0,80.0,89000.0,89000.0,49522.5701,20210130,预计净利润89000万,"报告期内,新冠肺炎疫情在全球漫延,铝产品市场受到一定影响,随着国内疫情得到控制,复工复产全面推进,自6月以来铝产品价格企稳回升,全年长江铝锭,南储铝锭现货价分别为14,190元/吨,14,226元/吨,与2019年同期相比分别上涨1.77%,1.92%.面对疫情冲击和市场价格波动,公司积极应对,精准施策,加快重点项目建设及快速投产,新产能释放对业绩贡献明显增加;通过实施全要素对标和挑战极限降本等措施,持续加大铝合金加工产品营销力度,努力实现满产满销;科学把握采购节奏,拓展优化采购渠道,实现采购降本;积极争取疫情防控及复工复产等各项政策扶持.通过采取以上措施,公司铝商品产销量实现较大幅度增长,报告期公司经营业绩同比实现增长.",0
000807.SZ,20201015,20200930,预增,95.0,95.0,57000.0,57000.0,29216.8814,20201015,预计净利润57000万,"2020年，新冠肺炎疫情在全球蔓延，铝产品市场也受到一定影响，前三季度南储铝锭、长江铝锭现货价分别为13,714元/吨、13,675元/吨，与去年同期相比分别下跌1.49%、1.58%。随着国内疫情逐步得到有效控制，复工复产全面推进，自6月份以后铝产品价格企稳。面对疫情冲击和市场价格波动，云南铝业股份有限公司（以下简称“云铝股份”或“公司”）积极应对，精准施策，在防控好疫情的同时持续做好生产经营和重点项目建设及投产等各项工作，项目投产和新产能释放对业绩贡献明显增加。通过实施全要素对标和挑战极限降本等工作，技术指标和产品结构明显优化，单位产品人工成本等进一步下降；持续加大产品营销力度，增销降库，努力实现满产满销；科学把握采购节奏，实现采购降本；积极争取疫情防控及复工复产等各项政策扶持等。综上，公司的铝商品产销量同比实现较大幅度增长，报告期公司经营业绩与去年同期相比实现增长。",0
000807.SZ,20200715,20200630,预增,50.0,50.0,24000.0,24000.0,16070.9872,20200715,预计净利润24000万,"2020年上半年,南储铝锭,长江铝锭现货价分别为13,190元/吨,13,137元/吨,相比去年同期分别下跌4.61%,4.77%;2020年第二季度南储铝锭,长江铝锭现货价分别为13,065元/吨,12,990元/吨,与2020年第一季度环比分别下跌1.89%,2.23%.受新冠肺炎疫情冲击影响,云南铝业股份有限公司(以下简称“云铝股份”或“公司”)面临较为严峻的外部环境,为此,公司积极应对并精心做好疫情防控和生产经营各项工作,灵活调整产品结构,加大营销力度,增销降库;大力实施全要素对标和挑战极限降本措施,并积极争取疫情防控及复工复产等各项政策扶持.在国内疫情缓解后,国内市场企稳,公司克服各种困难抓紧项目建设和投产,产销量明显增加,报告期公司经营业绩与去年同期相比实现增长.",0
000807.SZ,20200415,20200331,预增,236.0,236.0,17000.0,17000.0,5058.07,20200415,预计净利润17000万,"报告期内,受新冠肺炎疫情影响,铝产品消费明显下降,铝产品价格出现较大幅度下跌,2020年一季度南储铝锭,长江铝锭现货价分别为13,202元/吨,13,171元/吨,相比去年同期分别下跌2.6%,2.65%,环比2019年四季度分别下跌6.14%,6.51%,三月份价格下跌幅度更大.受疫情冲击铝价下跌影响,特别是从三月份以来,云南铝业股份有限公司(以下简称“云铝股份”或“公司”)面临严峻的外部环境,公司积极应对并精心做好疫情防控和生产经营各项工作,灵活调整产品结构,加大营销力度,增销降库;采取各种措施降低原辅材料的采购成本.同时,大力实施各项内部挖潜和降本创效措施,并积极争取疫情防控及复工复产等各项政策扶持.公司报告期归属于上市公司股东的净利润与去年同期相比实现增长.后期,面对更大范围的疫情冲击和市场变化,公司将采取更有力的应对措施,努力保持公司生产经营正常稳定.",0
000807.SZ,20200203,20191231,扭亏,134.0,134.0,50000.0,50000.0,-146601.9023,20200203,预计净利润50000万,报告期内，受国家实施稳定宏观经济预期、减税降费等稳经济系列政策的影响，国内、国际铝市场价格逐步企稳，云南铝业股份有限公司（以下简称“云铝股份”或“公司”）紧紧抓住了市场企稳的有利时机，持续优化产品结构，加大产销和周边市场开拓力度，准确把握采购节奏，进一步提高氧化铝自产量，有效控制和降低了氧化铝、石油焦等大宗原辅料采购成本；并通过开展“三降三增”等专项活动，实施各项内部挖潜和降本创效措施，持续抓好生产经营和产业发展各项工作，加快推进了昭通水电铝一期项目、鹤庆水电铝一期项目投产达产，为公司增加了新的利润增长点。同时，公司积极争取国家和云南省支持加快水电铝材产业发展、铁路运输、生产经营等扶持政策，公司2019年全年归属于上市公司股东的净利润与2018年相比实现扭亏为盈。,0
