ts_code,ann_date,end_date,type,p_change_min,p_change_max,net_profit_min,net_profit_max,last_parent_net,first_ann_date,summary,change_reason,update_flag
000828.SZ,20210714,20210630,预增,66.51,66.51,53302.0,53302.0,32012.08,20210714,预计:净利润53302,"报告期,交通运输部发布的新冠肺炎疫情期间免收通行费相关政策已取消,高速公路收费恢复正常.2021年上半年,公司所属的莞深高速,参股单位广东虎门大桥有限公司的通行费收入大幅上升,同时公司参股单位东莞证券股份有限公司受益于资本市场交投活跃等影响,净利润同比增长44.58%,带动公司投资收益增长.综合以上,公司上半年实现的净利润同比大幅增长66.51%.",1
000828.SZ,20210714,20210630,预增,66.51,66.51,53302.0,53302.0,32012.08,20210714,预计净利润53302万,"报告期,交通运输部发布的新冠肺炎疫情期间免收通行费相关政策已取消,高速公路收费恢复正常.2021年上半年,公司所属的莞深高速,参股单位广东虎门大桥有限公司的通行费收入大幅上升,同时公司参股单位东莞证券股份有限公司受益于资本市场交投活跃等影响,净利润同比增长44.58%,带动公司投资收益增长.综合以上,公司上半年实现的净利润同比大幅增长66.51%.",0
000828.SZ,20210415,20210331,预增,115.09,115.09,23961.0,23961.0,11139.67,20210415,预计:净利润23961,"公司主营业务之一为高速公路运营管理.上年同期受交通运输部新冠肺炎疫情期间免收通行费相关政策影响,公司通行费收入比正常年份大幅下降,而本报告期收费政策恢复正常,公司第一季度的营业收入,净利润同比回升.",1
000828.SZ,20210415,20210331,预增,115.09,115.09,23961.0,23961.0,11139.67,20210415,预计净利润23961万,"公司主营业务之一为高速公路运营管理.上年同期受交通运输部新冠肺炎疫情期间免收通行费相关政策影响,公司通行费收入比正常年份大幅下降,而本报告期收费政策恢复正常,公司第一季度的营业收入,净利润同比回升.",0
000828.SZ,20200415,20200331,预减,-59.59,-59.59,11136.0,11136.0,27555.83,20200415,预计净利润11136万,公司主营业务之一为高速公路运营管理。交通运输部先后于2月3日、2月15日发布高速公路免收通行费的相关政策，并至新冠肺炎疫情防控工作结束。受以上免收通行费政策的影响，公司第一季度的通行费收入、营业收入同比下降，导致公司净利润同比下降。,0
