ts_code,ann_date,end_date,type,p_change_min,p_change_max,net_profit_min,net_profit_max,last_parent_net,first_ann_date,summary,change_reason,update_flag
000892.SZ,20260131,20251231,续亏,17.05,17.05,-20000.0,-20000.0,-24110.84,20260131,预计:净利润-20000,"1、2025年，公司持续深化主业布局，提升各项业务商业化变现能力，实现营收多样化。营业收入主要来源于影视剧和艺人经纪相关业务。报告期内，短剧业务收入大幅增加，公司营业收入较去年同期增长52%。2、报告期内，公司亏损主要来源于计提减值损失和业务转型投入期亏损。根据《企业会计准则》及公司会计政策相关规定，基于谨慎性原则，公司对存在减值迹象的各类资产计提减值损失。本次业绩预告情况已考虑计提减值准备对公司净利润的影响。截至目前，相关资产评估尚在进行中，以上数据尚需经会计师事务所审计，最终减值准备计提的金额以经会计师事务所审计的财务数据为准。3、报告期内，预计非经常性损益对当期净利润的影响金额约为20,000.00万元，主要原因系公司以前年度单独进行减值测试的合同资产款项减值准备转回。",1
000892.SZ,20260131,20251231,续亏,17.05,17.05,-20000.0,-20000.0,-24110.84,20260131,预计:净利润-20000,"1、2025年，公司持续深化主业布局，提升各项业务商业化变现能力，实现营收多样化。营业收入主要来源于影视剧和艺人经纪相关业务。报告期内，短剧业务收入大幅增加，公司营业收入较去年同期增长52%。2、报告期内，公司亏损主要来源于计提减值损失和业务转型投入期亏损。根据《企业会计准则》及公司会计政策相关规定，基于谨慎性原则，公司对存在减值迹象的各类资产计提减值损失。本次业绩预告情况已考虑计提减值准备对公司净利润的影响。截至目前，相关资产评估尚在进行中，以上数据尚需经会计师事务所审计，最终减值准备计提的金额以经会计师事务所审计的财务数据为准。3、报告期内，预计非经常性损益对当期净利润的影响金额约为20,000.00万元，主要原因系公司以前年度单独进行减值测试的合同资产款项减值准备转回。",0
000892.SZ,20250715,20250630,首亏,-131.1705,-131.1705,-500.0,-500.0,1604.08,20250715,预计:净利润-500,"报告期内，公司持续深化主业布局，提升各项业务商业化变现能力，实现营收多样化。营业收入主要来源于影视剧和艺人经纪相关业务。报告期内，公司不断探索短剧内容与营销模式的创新实践，均衡发力于平台精品短剧、小程序短剧、互动剧等多个细分领域，短剧业务收入大幅增加，导致公司营业收入较去年同期大幅增长。报告期内，公司持续推动业务结构的升级转型，已搭建了完备的短剧内容、编审、制作及运营团队，并与行业内优秀内容制作及创作团队合作。公司的业务结构优化及对短剧业务的投入力度加大，对短期业绩造成一定程度的影响，属于投入期利润亏损，但为公司业务结构转型和中长期发展奠定了良好基础。报告期内，预计非经常性损益对当期净利润的影响金额约为1,500.00万元，主要原因系公司主要诉讼达成和解，致使公司营业外支出冲减约1,300万元。",0
000892.SZ,20250118,20241231,续亏,49.64,49.64,-20000.0,-20000.0,-39713.22,20250118,预计:净利润-20000,（一）2024年，公司预计归属于上市公司股东的净利润为亏损，主要来源于公司预计减值损失约2.3亿元，该损失主要来源于2021年及以前年度开拍的影视剧项目的信用减值损失及存货减值损失。根据《企业会计准则》等相关要求，公司按照谨慎性原则计提相关资产减值损失及信用减值损失。以上数据尚需经会计师事务所审计，最终减值准备计提的金额以经会计师事务所审计的财务数据为准。（二）报告期内，公司积极推进影视剧的制作，保证优质内容的产出。公司影视剧项目《深潜》已于2024年11月13日在CCTV8和爱奇艺播出，《千香引》（更名为《千香》）已于2024年12月取得发行许可证，《佳偶天成》已于2024年9月份开机，待播的影视剧项目有《千香》《千秋令》《十年一品温如言》等。截至目前，公司拥有对《天命在我》《枭臣》《天香》《谪仙》《十州三境》《捕星司》等40余部IP的电视剧改编权。报告期内，公司不断深化短剧、互动剧、AIGC等业务布局。公司投资出品及制作的互动剧《完蛋，我被美女包围了2》已于2025年1月份杀青。公司在国内及海外短剧领域建立了较为完善的布局，已完成短剧运营投放平台的建设，在微信、抖音、快手等平台上的剧场账号及小程序矩阵已开始了付费及免费模式运营，海外短剧平台也已上线运营。同时，公司已经搭建了完备的短剧编剧及投流团队，并与行业内优秀内容制作及创作团队合作，短剧IP储备丰富。,0
000892.SZ,20240713,20240630,扭亏,134.5628,134.5628,1500.0,1500.0,-4339.93,20240713,预计:净利润1500,报告期内，公司营业收入主要来源于艺人经纪和影视剧相关业务，公司持续深化主业布局，以剧集制作和艺人经纪为基础，提升各项业务商业化变现能力，积极探索布局新的战略方向。报告期内，归属于上市公司股东的净利润和扣非净利润均实现扭亏为盈。公司积极推进影视剧的制作，保证优质剧集内容产出。公司影视剧项目《千香引》已于2024年4月杀青，现进入后期制作阶段。目前，公司拥有对《天命在我》《佳偶天成》《枭臣》《天香》《谪仙》《十州三境》《捕星司》等40余部IP的电视剧改编权。公司搭建了完善的艺人梯队，并持续加强艺人培养和服务，拓展艺人经纪多样化模式。同时，公司积极开展短剧、互动剧等业务，已经搭建短剧制作和运营团队，公司国内短剧小程序平台已上线试运行，并正在积极探索海外短剧业务。,1
000892.SZ,20240713,20240630,扭亏,134.5628,134.5628,1500.0,1500.0,-4339.93,20240713,预计:净利润1500,报告期内，公司营业收入主要来源于艺人经纪和影视剧相关业务，公司持续深化主业布局，以剧集制作和艺人经纪为基础，提升各项业务商业化变现能力，积极探索布局新的战略方向。报告期内，归属于上市公司股东的净利润和扣非净利润均实现扭亏为盈。公司积极推进影视剧的制作，保证优质剧集内容产出。公司影视剧项目《千香引》已于2024年4月杀青，现进入后期制作阶段。目前，公司拥有对《天命在我》《佳偶天成》《枭臣》《天香》《谪仙》《十州三境》《捕星司》等40余部IP的电视剧改编权。公司搭建了完善的艺人梯队，并持续加强艺人培养和服务，拓展艺人经纪多样化模式。同时，公司积极开展短剧、互动剧等业务，已经搭建短剧制作和运营团队，公司国内短剧小程序平台已上线试运行，并正在积极探索海外短剧业务。,0
000892.SZ,20240131,20231231,首亏,-1882.6702,-1882.6702,-32000.0,-32000.0,1795.06,20240131,预计:净利润-32000,"（一）2023年，公司预计归属于上市公司股东的净利润为亏损，主要原因如下：1、报告期内，公司预计减值损失约为3.2亿元，主要来源于2020年及以前年度开拍的影视剧项目的信用减值损失及存货减值损失。根据《企业会计准则》等相关要求，公司按照谨慎性原则计提相关资产减值损失及信用减值损失。以上数据尚需经会计师事务所审计，最终减值准备计提的金额以经会计师事务所审计的财务数据为准。2、报告期内，公司营业收入主要来源于影视剧销售及艺人经纪业务，公司影视剧销售收入较上年同期减少，导致营业收入同比减少。3、报告期内，公司非经常性损益金额约为-4,400万元，主要系计提诉讼赔偿款所致。（二）报告期内，公司坚持深耕影视文化产业，坚定战略方向、拥抱产业变革，积极探索布局影视科技、短剧、互动剧等方向。公司投资制作的影视剧《十年一品温如言》《莲花楼》取得发行许可证，《莲花楼》《南风知我意》等实现首播。报告期内，公司各项业务布局稳步推进，总体抗风险能力持续增强，经营活动产生的现金流量净额约为1.8亿元；报告期末，货币资金余额较2023年第三季度报告期末有所增加。",1
000892.SZ,20240131,20231231,首亏,-1882.6702,-1882.6702,-32000.0,-32000.0,1795.06,20240131,预计:净利润-32000,"（一）2023年，公司预计归属于上市公司股东的净利润为亏损，主要原因如下：1、报告期内，公司预计减值损失约为3.2亿元，主要来源于2020年及以前年度开拍的影视剧项目的信用减值损失及存货减值损失。根据《企业会计准则》等相关要求，公司按照谨慎性原则计提相关资产减值损失及信用减值损失。以上数据尚需经会计师事务所审计，最终减值准备计提的金额以经会计师事务所审计的财务数据为准。2、报告期内，公司营业收入主要来源于影视剧销售及艺人经纪业务，公司影视剧销售收入较上年同期减少，导致营业收入同比减少。3、报告期内，公司非经常性损益金额约为-4,400万元，主要系计提诉讼赔偿款所致。（二）报告期内，公司坚持深耕影视文化产业，坚定战略方向、拥抱产业变革，积极探索布局影视科技、短剧、互动剧等方向。公司投资制作的影视剧《十年一品温如言》《莲花楼》取得发行许可证，《莲花楼》《南风知我意》等实现首播。报告期内，公司各项业务布局稳步推进，总体抗风险能力持续增强，经营活动产生的现金流量净额约为1.8亿元；报告期末，货币资金余额较2023年第三季度报告期末有所增加。",0
000892.SZ,20230715,20230630,首亏,-251.72,-251.72,-4500.0,-4500.0,2966.07,20230715,预计:净利润-4500,"报告期内，公司营业收入主要来源于艺人经纪及影视剧多轮发行。报告期内，受项目周期影响，影视剧项目收入同比下降，使得公司整体营业收入同比下降，公司归属于上市公司股东的净利润预计为亏损。报告期内，公司继续深耕主业，在行业降本增效及科技高速发展的趋势下，坚定战略方向、拥抱产业变革。公司深化打造自有IP体系，围绕核心IP进行立体化开发，推出优秀作者的IP共建计划，与业内知名作者、编剧建立长期合作。同时，公司持续推进制作服务管理平台建设，建立与主创良好的合作机制，搭建数字化、工业化的内容制作体系，保证持续产出高品质项目。报告期内，公司投资制作的影视剧项目《十年一品温如言》《莲花楼》取得发行许可证。另外，公司不断深化艺人服务管理平台建设，加强对艺人经纪服务团队的专业化建设，提升对艺人的全面赋能，完善艺人数据化服务体系。报告期内，公司非经常性损益金额约为3,100万元，主要系计提诉讼赔偿款所致。",1
000892.SZ,20230715,20230630,首亏,-251.72,-251.72,-4500.0,-4500.0,2966.07,20230715,预计:净利润-4500,"报告期内，公司营业收入主要来源于艺人经纪及影视剧多轮发行。报告期内，受项目周期影响，影视剧项目收入同比下降，使得公司整体营业收入同比下降，公司归属于上市公司股东的净利润预计为亏损。报告期内，公司继续深耕主业，在行业降本增效及科技高速发展的趋势下，坚定战略方向、拥抱产业变革。公司深化打造自有IP体系，围绕核心IP进行立体化开发，推出优秀作者的IP共建计划，与业内知名作者、编剧建立长期合作。同时，公司持续推进制作服务管理平台建设，建立与主创良好的合作机制，搭建数字化、工业化的内容制作体系，保证持续产出高品质项目。报告期内，公司投资制作的影视剧项目《十年一品温如言》《莲花楼》取得发行许可证。另外，公司不断深化艺人服务管理平台建设，加强对艺人经纪服务团队的专业化建设，提升对艺人的全面赋能，完善艺人数据化服务体系。报告期内，公司非经常性损益金额约为3,100万元，主要系计提诉讼赔偿款所致。",0
000892.SZ,20230131,20221231,扭亏,107.4922,107.4922,2500.0,2500.0,-33368.2,20230131,预计:净利润2500,"报告期内，公司始终坚持新时代党对文艺工作的要求、始终保持高度的社会责任感、始终坚持弘扬传播社会主义核心价值观和新时代中华文化精神为己任，深耕影视文化产业，围绕IP打造、内容制作、艺人服务，稳步探索推进数字化、平台化的战略布局。报告期内，公司管理团队坚定推进战略落地，贯彻降本增效，落实精细化管理，初见成效。公司归属于上市公司股东的净利润和扣非净利润均实现扭亏为盈，公司投资制作的影视剧项目《山河月明》《沉香如屑》《沉香重华》，网络电影《赤脚大仙》《猛龙过沟》实现首播；投资制作或参与联合投资的电影《秋蝉》《长津湖之水门桥》《熊出没·重返地球》《十年一品温如言》上映。报告期内，非经常性损益金额约为-3,900万元，主要系投资者诉讼。",1
000892.SZ,20230131,20221231,扭亏,107.4922,107.4922,2500.0,2500.0,-33368.2,20230131,预计净利润2500万,"报告期内，公司始终坚持新时代党对文艺工作的要求、始终保持高度的社会责任感、始终坚持弘扬传播社会主义核心价值观和新时代中华文化精神为己任，深耕影视文化产业，围绕IP打造、内容制作、艺人服务，稳步探索推进数字化、平台化的战略布局。报告期内，公司管理团队坚定推进战略落地，贯彻降本增效，落实精细化管理，初见成效。公司归属于上市公司股东的净利润和扣非净利润均实现扭亏为盈，公司投资制作的影视剧项目《山河月明》《沉香如屑》《沉香重华》，网络电影《赤脚大仙》《猛龙过沟》实现首播；投资制作或参与联合投资的电影《秋蝉》《长津湖之水门桥》《熊出没·重返地球》《十年一品温如言》上映。报告期内，非经常性损益金额约为-3,900万元，主要系投资者诉讼。",0
000892.SZ,20220715,20220630,预增,164.3,164.3,3000.0,3000.0,1135.08,20220715,预计:净利润3000,"报告期内，公司继续以推出更多展现新时代精神气象的优秀作品为己任，坚定文化自信、传承中华文明，不断加强数字化、规范化建设，围绕着打造内容制作和艺人经纪服务平台，持续深化布局。同时，公司在文旅、MCN、服装衍生品、数字艺人、数字资产等业务方向积极探索与布局，各项业务稳步推进。报告期内，公司项目预售的模式提升了业绩的稳定性，有利于改善现金流。同时，公司积极推进影视剧项目的播出和回款工作，持续推进库存项目的销售，提升运营效率。公司在现实题材、软科幻题材、青春谍战、仙侠、探险等题材上积极探索内容的系列化，强化了与各大平台的合作关系。报告期内，公司影视剧项目《山河月明》实现首播，参与联合投资的电影《长津湖之水门桥》《熊出没·重返地球》《十年一品温如言》相继上映。报告期内，公司非经常性损益金额约为-4,500万元，主要系计提诉讼赔偿款及支付部分和解款所致。",1
000892.SZ,20220715,20220630,预增,164.3,164.3,3000.0,3000.0,1135.08,20220715,预计净利润3000万,"报告期内，公司继续以推出更多展现新时代精神气象的优秀作品为己任，坚定文化自信、传承中华文明，不断加强数字化、规范化建设，围绕着打造内容制作和艺人经纪服务平台，持续深化布局。同时，公司在文旅、MCN、服装衍生品、数字艺人、数字资产等业务方向积极探索与布局，各项业务稳步推进。报告期内，公司项目预售的模式提升了业绩的稳定性，有利于改善现金流。同时，公司积极推进影视剧项目的播出和回款工作，持续推进库存项目的销售，提升运营效率。公司在现实题材、软科幻题材、青春谍战、仙侠、探险等题材上积极探索内容的系列化，强化了与各大平台的合作关系。报告期内，公司影视剧项目《山河月明》实现首播，参与联合投资的电影《长津湖之水门桥》《熊出没·重返地球》《十年一品温如言》相继上映。报告期内，公司非经常性损益金额约为-4,500万元，主要系计提诉讼赔偿款及支付部分和解款所致。",0
000892.SZ,20220428,20211231,续亏,57.48,57.48,-33368.0,-33368.0,-78485.53,20220129,预计:净利润-33368,因公司一部影视剧项目可实现的采购价格出现了大幅调减，销售价格与首次业绩预告前询价存在较大差异。公司根据上述情况，对该剧预计可变现净值计提了存货跌价准备约2.43亿元，这将减少2021年度归属于母公司所有者的净利润2.43亿元，相应减少2021年末归属于母公司权益2.43亿元（本次拟计提存货减值准备金额为公司财务部门初步测算的结果，尚需经会计师事务所审计，最终数据以经会计师事务所审计的财务数据为准）。,1
000892.SZ,20220428,20211231,续亏,57.48,57.48,-33368.0,-33368.0,-78485.53,20220129,预计净利润-33368万,因公司一部影视剧项目可实现的采购价格出现了大幅调减，销售价格与首次业绩预告前询价存在较大差异。公司根据上述情况，对该剧预计可变现净值计提了存货跌价准备约2.43亿元，这将减少2021年度归属于母公司所有者的净利润2.43亿元，相应减少2021年末归属于母公司权益2.43亿元（本次拟计提存货减值准备金额为公司财务部门初步测算的结果，尚需经会计师事务所审计，最终数据以经会计师事务所审计的财务数据为准）。,0
000892.SZ,20220129,20211231,续亏,85.98,85.98,-11000.0,-11000.0,-78485.53,20220129,预计:净利润-11000,"（一）报告期内，公司的营业收入主要来自影视剧销售业务及艺人经纪业务，较去年同期相比增加了154.14%。公司对报告期末应收账款、存货及商誉等资产进行了审慎评估，2021年度公司确认减值损失约11,000万元，导致归属于本年度净利润出现亏损。（二）报告期内，公司始终坚持新时代党对文艺工作的要求、始终保持高度的社会责任感、始终坚持弘扬传播社会主义核心价值观和新时代中华文化精神为己任，围绕内容制作和艺人服务管理平台，稳步推进相关业务，在AI虚拟艺人、新媒体、电商、综艺、文旅、衍生品等业务方向积极探索与布局。1、在影剧制作方面，公司除了加强预售模式的深化、改善现金流外，还在现实题材、青春谍战、仙侠、探险等题材上积极探索内容的系列化，努力深挖IP潜力、着力打造品牌优势，强化了与各大平台的合作关系。报告期内，公司在各大平台实现首播的影视剧包括《云顶天宫》《不说再见》《与君歌》《天目危机》《岁月忽已暮》《御龙修仙传2》等，参与联合投资的电影《革命者》《长津湖》也相继上映。公司目前正在创作中的影视剧（含非执行制片剧）包括《十年一品温如言》《南风知我意》《瑶象传奇》《沉香如屑》《千秋令》等；已取得发行许可证或上线备案号的影视剧为《南风知我意》《权与利》《与君歌》《云顶天宫》。2、公司在深化艺人经纪产业布局，打造艺人经纪服务平台方面取得了长足进步。公司已经从培养艺人，提升到“选、育、服”全产业链的打造，既注重艺人的选拨，也加强艺人梯队的持续的优化，已明显降低了对于单个艺人的依赖度。同时，注重对艺人专业素养、道德品质的培养及提升。持续深化艺人服务管理平台建设，持续探索艺人服务专业化、信息化、标准化的管理体系。截至公告披露日，公司拥有任嘉伦、成毅、李小冉、张予曦、颖儿、侯梦瑶、韩栋、袁冰妍、张睿、刘学义、何中华、刘欢、张天阳、杨肸子、孙泽源、傅方俊、黄羿、徐恺咛等签约艺人。公司已成为国内艺人经纪业务领先企业和优秀艺人的培养服务平台。（三）报告期内，非经常性损益金额为约5,000万元，主要系影视剧《封神之天启》诉讼事项和解，冲回前期已计提的预计负债所致。",1
000892.SZ,20211015,20210930,扭亏,141.8061,141.8061,6200.0,6200.0,-14830.37,20211015,预计:净利润6200,"报告期内，公司影视剧销售收入及艺人经纪收入较上年同期有所增长，公司净利润实现扭亏为盈。围绕着打造内容制作和艺人服务管理平台，公司主营业务稳步推进，在AI虚拟演员、新媒体、电商、综艺、文旅、衍生品等业务方向积极探索与布局。公司加强推进项目的销售、播出和回款工作，改善现金流，致力于制作符合社会主义新时代主流价值观的精品影视剧，在青春励志、青春谍战、仙侠、探险等题材上积极探索系列化的内容，打造品牌优势、强化了与各大平台的良好合作。截至本报告披露日，在平台实现首播的影视剧包括《云顶天宫》《不说再见》《与君歌》《天目危机》《岁月忽已暮》《御龙修仙传2》等，参与联合投资的电影《革命者》《长津湖》上映。公司在创作中的影视剧（含非执行制片剧）包括《十年一品温如言》《南风知我意》《瑶象传奇》《沉香如屑》《千秋令》等。公司持续深化艺人服务管理平台建设，注重对艺人专业素养、道德品质等培养及提升，探索艺人服务专业化、信息化、标准化的管理体系。报告期内，公司拥有杨紫、任嘉伦、成毅、张予曦、颖儿、侯梦瑶、韩栋、袁冰妍、张睿、刘学义等40位签约艺人。报告期内，非经常性损益金额约4,880万元，主要系影视剧《封神之天启》诉讼事项和解，冲回前期已计提的预计负债所致。",1
000892.SZ,20211015,20210930,扭亏,141.8061,141.8061,6200.0,6200.0,-14830.37,20211015,预计净利润6200万,"报告期内，公司影视剧销售收入及艺人经纪收入较上年同期有所增长，公司净利润实现扭亏为盈。围绕着打造内容制作和艺人服务管理平台，公司主营业务稳步推进，在AI虚拟演员、新媒体、电商、综艺、文旅、衍生品等业务方向积极探索与布局。公司加强推进项目的销售、播出和回款工作，改善现金流，致力于制作符合社会主义新时代主流价值观的精品影视剧，在青春励志、青春谍战、仙侠、探险等题材上积极探索系列化的内容，打造品牌优势、强化了与各大平台的良好合作。截至本报告披露日，在平台实现首播的影视剧包括《云顶天宫》《不说再见》《与君歌》《天目危机》《岁月忽已暮》《御龙修仙传2》等，参与联合投资的电影《革命者》《长津湖》上映。公司在创作中的影视剧（含非执行制片剧）包括《十年一品温如言》《南风知我意》《瑶象传奇》《沉香如屑》《千秋令》等。公司持续深化艺人服务管理平台建设，注重对艺人专业素养、道德品质等培养及提升，探索艺人服务专业化、信息化、标准化的管理体系。报告期内，公司拥有杨紫、任嘉伦、成毅、张予曦、颖儿、侯梦瑶、韩栋、袁冰妍、张睿、刘学义等40位签约艺人。报告期内，非经常性损益金额约4,880万元，主要系影视剧《封神之天启》诉讼事项和解，冲回前期已计提的预计负债所致。",0
