ts_code,ann_date,end_date,type,p_change_min,p_change_max,net_profit_min,net_profit_max,last_parent_net,first_ann_date,summary,change_reason,update_flag
000987.SZ,20260411,20260331,预增,90.0,110.0,124742.0,137872.0,65654.0,20260411,预计:净利润124742-137872,2026年第一季度，公司控股子公司广州资产管理有限公司投行化转型成效显著，相关业务收益大幅提升。此外，资本市场保持良好发展态势，交易活跃度维持高位水平，参股公司中信证券股份有限公司经营业绩实现较快增长，公司投资收益相应增加。,0
000987.SZ,20260121,20251231,预增,50.0,60.0,344099.0,367039.0,229399.0,20260121,预计:净利润344099-367039,（一）2025年，公司积极把握资本市场稳健发展机遇，投资业务收益大幅提升。同时，新能源业务发电量随装机容量持续增长，经营效益不断提升，公司绿色转型成效显著。（二）2025年，公司对所持北京控股有限公司、新天绿色能源股份有限公司股权资产的会计核算方法由交易性金融资产变更为长期股权投资，详见公司2025年10月11日发布在巨潮资讯网（www.cninfo.com.cn）的《关于变更对参股公司会计核算方法的公告》（公告编号：2025-058）。公司全年预计分别确认一次性收益约22.90亿元、2.98亿元，将分别增加公司2025年度归母净利润约11.85亿元、1.34亿元，相关收益为非经常性损益。与此有关的资产评估工作尚在有序推进中，实际财务影响以公司定期报告披露数据为准。（三）根据《企业会计准则》和公司会计政策的相关规定，为准确、客观的反映公司2025年12月31日的财务状况及2025年度的经营成果，公司对债权投资、长期应收款、应收款项及其他等资产进行全面清查和减值测试，预计2025年度计提各项资产减值准备和信用减值准备16亿元~18亿元，预计减少公司2025年度归母净利润约8.50亿元~9.50亿元，实际财务影响以公司定期报告披露数据为准。,0
000987.SZ,20251011,20250930,预增,70.0,80.0,292210.0,309398.0,171888.0,20251011,预计:净利润292210-309398,（一）2025年前三季度，公司积极把握资本市场稳健发展机遇，投资业务收益实现同比提升；同时，新能源业务发电量随装机容量持续增长，经营效益不断提升，公司绿色转型成效显著。（二）公司控股子公司广州资产管理有限公司持有北京控股有限公司4.14%股份，并于2025年9月30日获委任一名董事；公司控股子公司广州越秀产业投资有限公司持有新天绿色能源股份有限公司4.97%股份，并于2025年7月25日获委任一名董事。根据《企业会计准则》等相关规定，公司对所持前述股权资产的会计核算方法由交易性金融资产变更为长期股权投资。公司财务部门根据初始投资成本与可辨认净资产公允价值的差额，预计分别确认一次性收益约20.22亿元、2.98亿元，将分别增加公司2025年第三季度归母净利润约10.47亿元、1.34亿元，相关收益为非经常性损益。与此有关的资产评估工作尚在有序推进中，实际财务影响以公司定期报告披露数据为准。（三）根据《企业会计准则》和公司会计政策的相关规定，为准确、客观的反映公司2025年9月30日的财务状况及2025年前三季度的经营成果，公司对债权投资、长期应收款、应收款项及其他等资产进行全面清查和减值测试，预计2025年前三季度计提各项资产减值准备和信用减值准备14亿元~16亿元，预计减少公司2025年前三季度归母净利润约7.20亿元~8.20亿元，实际计提情况及财务影响将在确定后另行披露。,1
000987.SZ,20251011,20250930,预增,70.0,80.0,292210.0,309398.0,171888.0,20251011,预计:净利润292210-309398,（一）2025年前三季度，公司积极把握资本市场稳健发展机遇，投资业务收益实现同比提升；同时，新能源业务发电量随装机容量持续增长，经营效益不断提升，公司绿色转型成效显著。（二）公司控股子公司广州资产管理有限公司持有北京控股有限公司4.14%股份，并于2025年9月30日获委任一名董事；公司控股子公司广州越秀产业投资有限公司持有新天绿色能源股份有限公司4.97%股份，并于2025年7月25日获委任一名董事。根据《企业会计准则》等相关规定，公司对所持前述股权资产的会计核算方法由交易性金融资产变更为长期股权投资。公司财务部门根据初始投资成本与可辨认净资产公允价值的差额，预计分别确认一次性收益约20.22亿元、2.98亿元，将分别增加公司2025年第三季度归母净利润约10.47亿元、1.34亿元，相关收益为非经常性损益。与此有关的资产评估工作尚在有序推进中，实际财务影响以公司定期报告披露数据为准。（三）根据《企业会计准则》和公司会计政策的相关规定，为准确、客观的反映公司2025年9月30日的财务状况及2025年前三季度的经营成果，公司对债权投资、长期应收款、应收款项及其他等资产进行全面清查和减值测试，预计2025年前三季度计提各项资产减值准备和信用减值准备14亿元~16亿元，预计减少公司2025年前三季度归母净利润约7.20亿元~8.20亿元，实际计提情况及财务影响将在确定后另行披露。,0
000987.SZ,20250709,20250630,预增,45.0,55.0,147308.0,157467.0,101591.0,20250709,预计:净利润147308-157467,2025年上半年，公司积极把握资本市场稳健发展机遇，投资业务收益实现同比提升；同时，新能源业务发电量随装机容量持续增长，经营效益不断提升，公司绿色转型成效显著。,0
000987.SZ,20250415,20250331,略增,39.58,39.58,65218.0,65218.0,46723.32,20250415,预计:净利润65218,2025年第一季度，国内资本市场稳健发展，带动公司投资收益同比提升；同时，公司绿色转型成果逐步显现，经营效益同比提升。,0
000987.SZ,20211015,20210930,预减,-58.0,-53.0,190000.0,210000.0,451099.0,20211015,预计:净利润190000-210000,公司2021年前三季度经营业绩较上年同期大幅下降，主要是上年同期完成向中信证券股份有限公司（以下简称“中信证券”）出售广州证券股份有限公司100%股权项目确认投资收益以及收到政府补助，相关事项对上年同期归属于上市公司股东净利润的影响为31.66亿元，该收益属于非经常性损益。扣除非经常性损益后，公司2021年前三季度经营业绩较上年同期大幅增长，主要是：1、不良资产管理、投资管理等业务经营业绩较上年同期大幅提升；2、投资中信证券股权收益较上年同期大幅增长。,1
000987.SZ,20211015,20210930,预减,-58.0,-53.0,190000.0,210000.0,451099.0,20211015,预计净利润190000-210000万,公司2021年前三季度经营业绩较上年同期大幅下降，主要是上年同期完成向中信证券股份有限公司（以下简称“中信证券”）出售广州证券股份有限公司100%股权项目确认投资收益以及收到政府补助，相关事项对上年同期归属于上市公司股东净利润的影响为31.66亿元，该收益属于非经常性损益。扣除非经常性损益后，公司2021年前三季度经营业绩较上年同期大幅增长，主要是：1、不良资产管理、投资管理等业务经营业绩较上年同期大幅提升；2、投资中信证券股权收益较上年同期大幅增长。,0
000987.SZ,20210710,20210630,预减,-71.0,-69.0,118000.0,125000.0,403767.0,20210710,预计:净利润118000-125000,业绩变动的主要原因说明:公司2021年上半年经营业绩较上年同期大幅下降，主要是上年同期完成向中信证券股份有限公司（以下简称“中信证券”）出售广州证券股份有限公司100%股权项目确认投资收益以及收到政府补助，相关事项对上年同期归属于上市公司股东净利润的影响为33.01亿元，该收益属于非经常性损益。扣除非经常性损益后，公司2021年上半年经营业绩较上年同期大幅增长，主要是：1、不良资产管理、投资管理等业务经营业绩较上年同期大幅提升；2、投资中信证券股权收益较上年同期大幅增长。,1
000987.SZ,20210710,20210630,预减,-71.0,-69.0,118000.0,125000.0,403767.0,20210710,预计净利润118000-125000万,业绩变动的主要原因说明:公司2021年上半年经营业绩较上年同期大幅下降，主要是上年同期完成向中信证券股份有限公司（以下简称“中信证券”）出售广州证券股份有限公司100%股权项目确认投资收益以及收到政府补助，相关事项对上年同期归属于上市公司股东净利润的影响为33.01亿元，该收益属于非经常性损益。扣除非经常性损益后，公司2021年上半年经营业绩较上年同期大幅增长，主要是：1、不良资产管理、投资管理等业务经营业绩较上年同期大幅提升；2、投资中信证券股权收益较上年同期大幅增长。,0
000987.SZ,20210415,20210331,预减,-85.0,-84.0,52000.0,58000.0,352517.0,20210415,预计:净利润52000-58000,公司2021年第一季度经营业绩较上年同期大幅下降，主要是上年同期完成向中信证券股份有限公司出售广州证券股份有限公司100%股权项目确认相关投资收益以及收到政府补助，相关事项对归属于上市公司股东净利润的影响为32.78亿元，该收益属于非经常性损益。扣除非经常性损益后，公司2021年第一季度经营业绩较上年同期大幅增长，主要是不良资产管理、投资业务等经营业绩较上年同期大幅提升。,1
000987.SZ,20210415,20210331,预减,-85.0,-84.0,52000.0,58000.0,352517.0,20210415,预计净利润52000-58000万,公司2021年第一季度经营业绩较上年同期大幅下降，主要是上年同期完成向中信证券股份有限公司出售广州证券股份有限公司100%股权项目确认相关投资收益以及收到政府补助，相关事项对归属于上市公司股东净利润的影响为32.78亿元，该收益属于非经常性损益。扣除非经常性损益后，公司2021年第一季度经营业绩较上年同期大幅增长，主要是不良资产管理、投资业务等经营业绩较上年同期大幅提升。,0
000987.SZ,20210123,20201231,预增,101.0,106.0,454000.0,466000.0,226341.0,20210123,预计净利润454000-466000万,"公司2020年经营业绩较上年同期上升,主要因为:1,不良资产管理,融资租赁,资本投资等业务经营业绩较上年同期均大幅提升;2,自2020年3月起对持有的中信证券股权按权益法核算投资收益;3,非经常性损益大幅增加,主要是公司出售广州证券100%股权确认投资收益32.80亿元.",0
000987.SZ,20201015,20200930,预增,134.0,138.0,446500.0,454600.0,190823.0,20201015,预计净利润446500-454600万,公司2020年前三季度经营业绩较上年同期上升，主要因为：1、不良资产管理、融资租赁、产业基金、资本投资等业务经营业绩较上年同期均有所提升；2、自2020年3月起对持有的中信证券股权按权益法核算投资收益；3、非经常性损益大幅增加，主要是公司出售广州证券100%股权确认投资收益32.80亿元。,0
000987.SZ,20200710,20200630,预增,158.0,170.0,387694.0,405209.0,150007.0,20200710,预计净利润387694-405209万,本报告期公司经营业绩较上年同期上升，主要是：1、不良资产管理、融资租赁、产业基金、资本投资等业务经营业绩较上年同期均有所提升；2、自3月份起对中信证券股权按权益法核算投资收益；3、非经常性损益大幅增加，本报告期公司出售剥离相关资产后广州证券100%股权影响归属于上市公司股东净利润32.64亿元，2019年同期出售广州友谊影响归属于上市公司股东净利润9.36亿元。,0
000987.SZ,20200328,20200331,预增,1146.0,1182.0,344505.0,354505.0,27652.0,20200328,预计净利润344505-354505万,"1、融资租赁业务经营业绩较上年同期大幅提升；2、非经常性损益大幅增加，主要是公司向中信证券出售资产剥离后的广州证券100%股权项目已完成，公司以获取的中信证券股票公允价值与对广州证券的持有成本、交割日资产减值补偿支出、交割日后资产保障计提的预计负债的差额确认投资收益32.64亿元，对归属于上市公司股东的净利润影响为32.64亿元，属于非经常性损益。其中，交割日资产减值补偿情况，详见公司于2020年3月7日在巨潮资讯网披露的《关于签署重大资产出售事项补充协议及支付资产减值补偿的公告》（公告编号：2020-026）；截至目前的预计负债计提情况，详见公司2020年3月28日在巨潮资讯网披露的《关于计提预计负债的公告》（公告编号：2020-035）。公司已于2020年1月10日向中信证券股份有限公司（以下简称“中信证券”）及其全资子公司完成剥离相关资产后广州证券股份有限公司（已更名为“中信证券华南股份有限公司”，以下简称“广州证券”）100%股份的交割，并于2020年3月11日收到中信证券发行的交易对价809,867,629股股份。上表中，上年同期重大资产出售后归属于上市公司股东的净利润系按照“公司于2019年1月完成对广州证券的交割，公司于2019年3月收到中信证券发行的交易对价809,867,629股股份”为主要前提而进行的模拟数据列示，未考虑本次资产出售的交易所得，所采用的其他会计处理方法与本报告期一致。本报告期和上年同期的基本每股收益均按照公司总股本2,752,884,754股计算得出。上表中涉及中信证券的财务数据，均根据其公开披露于巨潮资讯网的数据合理推算而得。",0
000987.SZ,20200118,20191231,预增,150.0,165.0,112500.0,119300.0,44998.0,20200118,预计净利润112500-119300万,"1、不良资产管理业务和融资租赁业务经营业绩较上年同期大幅提升。2、非经常性损益大幅增加，主要是出售全资子公司广州友谊集团有限公司100%股权实现投资收益135,249万元,对归属于上市公司股东的净利润的影响为94,053万元。",0
