ts_code,ann_date,end_date,type,p_change_min,p_change_max,net_profit_min,net_profit_max,last_parent_net,first_ann_date,summary,change_reason,update_flag
000959.SZ,20251231,20251231,预增,95.29,125.01,92000.0,106000.0,47109.0,20251231,预计:净利润92000-106000,报告期内，公司坚定不移持续优化产品结构，坚持产品高端化、差异化发展方向，为公司业绩改善、保持经营韧性提供了重要支撑；坚持“极低成本”管理理念，公司消耗降本、技术降本、协同降本工作再上新台阶；坚持以技术创新为引领，推动技术创新与管理创新、商业模式创新深度融合，用内部工作抵御外部市场风险，有效提升了市场竞争力。,0
000959.SZ,20250711,20250630,预增,62.62,70.22,64200.0,67200.0,39478.0,20250711,预计:净利润64200-67200,报告期内，公司坚持创新驱动，持续优化产品结构与客户结构，坚持打造“制造+服务”竞争优势，战略产品产销量同比增长；公司生产顺稳，通过持续与标杆企业对标，深挖全要素降本潜力，有效降低生产成本，对冲外部市场减利因素，2025年上半年经营业绩同比增长。,0
000959.SZ,20230715,20230630,预减,-80.0,-74.0,36600.0,46600.0,179531.0,20230715,预计:净利润36600-46600,2023年上半年，受国际环境诸多因素扰动影响，国内经济恢复不及预期，钢材市场需求不足，价格出现较大幅度下滑。面对不利局面，公司努力克服市场不利影响，坚持极低成本运行，注重效率、效益提升，持续挖掘自身潜力，强化市场运作，二季度经济效益明显提升，但受整体经营环境影响，同比仍出现较大幅度降低。,1
000959.SZ,20230715,20230630,预减,-80.0,-74.0,36600.0,46600.0,179531.0,20230715,预计:净利润36600-46600,2023年上半年，受国际环境诸多因素扰动影响，国内经济恢复不及预期，钢材市场需求不足，价格出现较大幅度下滑。面对不利局面，公司努力克服市场不利影响，坚持极低成本运行，注重效率、效益提升，持续挖掘自身潜力，强化市场运作，二季度经济效益明显提升，但受整体经营环境影响，同比仍出现较大幅度降低。,0
000959.SZ,20230131,20221231,预减,-85.0,-80.0,110000.0,140000.0,710649.0,20230131,预计:净利润110000-140000,2022年，受国际局势复杂多变、国内疫情反复等多重不利因素影响，国内钢材销售价格持续走低，原燃料总体高位运行。虽然公司努力强化市场运作、优化产品结构、持续转型提效，但受市场整体环境影响，报告期内公司经营业绩同比仍出现较大幅度降低。,1
000959.SZ,20230131,20221231,预减,-85.0,-80.0,110000.0,140000.0,710649.0,20230131,预计净利润110000-140000万,2022年，受国际局势复杂多变、国内疫情反复等多重不利因素影响，国内钢材销售价格持续走低，原燃料总体高位运行。虽然公司努力强化市场运作、优化产品结构、持续转型提效，但受市场整体环境影响，报告期内公司经营业绩同比仍出现较大幅度降低。,0
000959.SZ,20220128,20211231,预增,286.0,309.0,690000.0,730000.0,178645.0,20220128,预计:净利润690000-730000,报告期内，公司精准落实疫情防控措施，实现“三零”目标；继续保持环保绩效评价A类，生产经营稳定有序；坚持创新驱动和“制造+服务”战略，抓住市场机遇，产线与市场高效协同，不断优化产品结构，持续提升公司盈利能力；以效益为中心，深化对标挖潜，加大成本控制力度，消化上游价格上涨影响，持续提升管理效能；资本运作赋能，优化资产质量，提升核心竞争力，2021年经营业绩同比大幅增长。,1
000959.SZ,20220128,20211231,预增,286.0,309.0,690000.0,730000.0,178645.0,20220128,预计净利润690000-730000万,报告期内，公司精准落实疫情防控措施，实现“三零”目标；继续保持环保绩效评价A类，生产经营稳定有序；坚持创新驱动和“制造+服务”战略，抓住市场机遇，产线与市场高效协同，不断优化产品结构，持续提升公司盈利能力；以效益为中心，深化对标挖潜，加大成本控制力度，消化上游价格上涨影响，持续提升管理效能；资本运作赋能，优化资产质量，提升核心竞争力，2021年经营业绩同比大幅增长。,0
000959.SZ,20211008,20210930,预增,380.0,414.0,564000.0,604000.0,117500.0,20211008,预计:净利润564000-604000,1-9月份，公司抓住市场机遇，保顺稳、提效率、控环保，不断优化产品结构，提升核心竞争力，坚持对标挖潜、降本增效，经营业绩大幅增长；完成发行股份购买资产，提升对首钢京唐钢铁联合有限责任公司的持股比例，公司整体盈利能力进一步增强。,1
000959.SZ,20211008,20210930,预增,380.0,414.0,564000.0,604000.0,117500.0,20211008,预计净利润564000-604000万,1-9月份，公司抓住市场机遇，保顺稳、提效率、控环保，不断优化产品结构，提升核心竞争力，坚持对标挖潜、降本增效，经营业绩大幅增长；完成发行股份购买资产，提升对首钢京唐钢铁联合有限责任公司的持股比例，公司整体盈利能力进一步增强。,0
000959.SZ,20210701,20210630,预增,542.0,542.0,336000.0,336000.0,52319.0,20210701,预计:净利润336000,"上半年,公司抓住市场有利时机,坚持创新驱动和“精品+服务”,持续提升核心竞争力;坚持高端引领,不断优化产品结构;坚持绿色制造,智能制造,实现生产顺稳;坚持全面对标,深挖潜力,降本增收取得成效;持续推进资本运作,完成发行股份购买资产,盈利能力进一步增强.",1
000959.SZ,20210701,20210630,预增,542.0,542.0,336000.0,336000.0,52319.0,20210701,预计净利润336000万,"上半年,公司抓住市场有利时机,坚持创新驱动和“精品+服务”,持续提升核心竞争力;坚持高端引领,不断优化产品结构;坚持绿色制造,智能制造,实现生产顺稳;坚持全面对标,深挖潜力,降本增收取得成效;持续推进资本运作,完成发行股份购买资产,盈利能力进一步增强.",0
000959.SZ,20210407,20210331,预增,406.0,457.0,100000.0,110000.0,19759.0,20210407,预计:净利润100000-110000,"报告期内,公司抓住市场有利时机,进一步优化产品结构,提升高端领先产品比例,增强产品市场竞争力,加大市场开发,提升公司整体效益;深化内部对标挖潜,加大成本控制力度,努力消化上游原燃料价格上涨等不利因素影响,经济效益进一步显现.",1
000959.SZ,20210407,20210331,预增,406.0,457.0,100000.0,110000.0,19759.0,20210407,预计净利润100000-110000万,"报告期内,公司抓住市场有利时机,进一步优化产品结构,提升高端领先产品比例,增强产品市场竞争力,加大市场开发,提升公司整体效益;深化内部对标挖潜,加大成本控制力度,努力消化上游原燃料价格上涨等不利因素影响,经济效益进一步显现.",0
000959.SZ,20210130,20201231,预增,47.55,55.99,175000.0,185000.0,118600.0,20210130,预计净利润175000-185000万,"(一)公司统筹做好疫情防控和经营生产两方面工作,实现了零确诊,零疑似,零密接“三零”目标,生产呈现持续顺稳局面,实物产量创出新高;努力克服上游原材料价格上涨影响,加大产品结构优化及成本控制力度,经营协同更加深入,降本增效取得明显成效.(二)控股子公司首钢京唐钢铁联合有限责任公司(以下简称“京唐公司”)二期一步工程陆续投产,规模效益进一步显现,品种结构进一步丰富,经营业绩大幅提升;公司通过资产置换所持有京唐公司股权比例提高,增厚归属于上市公司股东净利润.",0
000959.SZ,20200715,20200630,预减,-53.09,-48.1,47000.0,52000.0,100194.0,20200715,预计净利润47000-52000万,"今年以来,受整体经济环境及疫情影响,上游铁矿石等原燃料价格处于相对高位,下游钢材产品需求减弱,钢材价格同比降幅较大.面对严峻的市场形势,公司坚持防疫,经营两手抓,在稳定生产运营局面的同时,加大产品结构优化及成本控制力度,但降本增效没能完全抵消供需市场的减利,经营业绩有所下滑.",0
