ts_code,ann_date,end_date,type,p_change_min,p_change_max,net_profit_min,net_profit_max,last_parent_net,first_ann_date,summary,change_reason,update_flag
001203.SZ,20220128,20211231,预增,161.1,202.34,153800.0,178089.0,58904.38,20220128,预计:净利润153800-178089,报告期内，公司产品市场向好，产品价格同比大幅上涨，公司把握市场机遇，充分发挥竞争优势，主要产品铁精粉和球团产销两旺。同时公司加强内部管理，深挖降本潜力，提升生产经营管理水平，盈利能力显著增强。,1
001203.SZ,20220128,20211231,预增,161.1,202.34,153800.0,178089.0,58904.38,20220128,预计净利润153800-178089万,报告期内，公司产品市场向好，产品价格同比大幅上涨，公司把握市场机遇，充分发挥竞争优势，主要产品铁精粉和球团产销两旺。同时公司加强内部管理，深挖降本潜力，提升生产经营管理水平，盈利能力显著增强。,0
001203.SZ,20211014,20210930,预增,314.41,359.22,134100.0,148600.0,32358.94,20211014,预计:净利润134100-148600,公司前三季度业绩较上年同期大幅增长的主要原因为：公司所处行业景气度较高，市场需求旺盛，主要产品销售价格大幅高于上年同期。公司把握市场机遇，充分发挥竞争优势，主要产品铁精粉和球团产销两旺。同时公司加强内部管理，深挖降本潜力，提升生产经营管理水平，盈利能力显著增强。,1
001203.SZ,20211014,20210930,预增,314.41,359.22,134100.0,148600.0,32358.94,20211014,预计净利润134100-148600万,公司前三季度业绩较上年同期大幅增长的主要原因为：公司所处行业景气度较高，市场需求旺盛，主要产品销售价格大幅高于上年同期。公司把握市场机遇，充分发挥竞争优势，主要产品铁精粉和球团产销两旺。同时公司加强内部管理，深挖降本潜力，提升生产经营管理水平，盈利能力显著增强。,0
001203.SZ,20210715,20210630,预增,735.99,816.57,83000.0,91000.0,9928.31,20210507,预计:净利润83000-91000,公司2021年上半年业绩增长的主要原因为受铁矿石价格指数大幅上涨的影响，公司主要产品销售价格大幅高于上年同期，公司把握上行机遇，铁精粉和球团产销两旺。同时公司加强内部管理，加大降本增效力度，不断提升生产经营管理水平，盈利能力显著增强，使得公司经营业绩同比大幅上升。,1
001203.SZ,20210715,20210630,预增,735.99,816.57,83000.0,91000.0,9928.31,20210507,预计净利润83000-91000万,公司2021年上半年业绩增长的主要原因为受铁矿石价格指数大幅上涨的影响，公司主要产品销售价格大幅高于上年同期，公司把握上行机遇，铁精粉和球团产销两旺。同时公司加强内部管理，加大降本增效力度，不断提升生产经营管理水平，盈利能力显著增强，使得公司经营业绩同比大幅上升。,0
001203.SZ,20210507,20210630,预增,455.09,556.02,55000.0,65000.0,9928.3051,20210507,预计:净利润55000-65000,,1
001203.SZ,20210412,20210331,预增,468.04,594.27,31052.0,37953.0,5469.7322,20210412,预计:净利润31052-37953,预计2021年1-3月营业收入较上年同期大幅增长，主要原因有两个：一是上年同期子公司金日晟矿业因采矿证续期及新冠疫情影响停产，上年同期营业收入基数较低，2021年1-3月该因素已经消除；二是受铁矿石价格指数大幅上涨的影响，2021年1-3月主要产品铁精粉销售价格预计大幅高于上年同期。公司业务属于黑色金属矿采选业，用自有矿山生产销售铁精粉，公司主要产品铁精粉的成本较为稳定，且不受铁矿石价格指数变动而变动，2021年1-2月62%铁矿石普氏指数均值为166.90美元/吨较2020年1-3月均值89.00美元/吨上涨87.53%，受铁精粉价格快速上涨的影响，公司预计2021年1-3月实现扣除非经常性损益后归属于母公司股东的净利润同比大幅上升。,1
