ts_code,ann_date,end_date,type,p_change_min,p_change_max,net_profit_min,net_profit_max,last_parent_net,first_ann_date,summary,change_reason,update_flag
001258.SZ,20260130,20251231,预增,89.31,119.2,9500.0,11000.0,5018.21,20260130,预计:净利润9500-11000,公司2025年业绩较上年同期增长的主要原因：一是报告期内新增投产的风电及独立储能项目带来上网电量及营业收入增加，同时项目并网后按规程开展设备调试与试运行验收，按会计准则要求匹配直接相关成本，试运行期产生的利润贡献同比增加；二是报告期内公司联营企业新疆华电天山发电有限公司所属“疆电外送”三通道发电项目年内陆续并网投运，为公司带来的投资收益增加。,1
001258.SZ,20260130,20251231,预增,89.31,119.2,9500.0,11000.0,5018.21,20260130,预计:净利润9500-11000,公司2025年业绩较上年同期增长的主要原因：一是报告期内新增投产的风电及独立储能项目带来上网电量及营业收入增加，同时项目并网后按规程开展设备调试与试运行验收，按会计准则要求匹配直接相关成本，试运行期产生的利润贡献同比增加；二是报告期内公司联营企业新疆华电天山发电有限公司所属“疆电外送”三通道发电项目年内陆续并网投运，为公司带来的投资收益增加。,0
001258.SZ,20250715,20250630,预减,-94.51,-91.76,500.0,750.0,9105.44,20250715,预计:净利润500-750,公司2025年半年度业绩较上年同期下降的主要原因：一是受新能源发电项目纳入补贴清单周期较长，及新能源发电项目补贴合规核查进度影响，应收新能源发电补贴回款滞后，公司应收补贴款规模及账龄增加，计提信用减值损失较上年同期增加；二是新疆区域新能源装机规模快速扩张，电网消纳负荷增量有限，致使报告期内限电率同比明显上升，公司新能源项目发电效率及发电业务毛利有所下降。,0
001258.SZ,20250123,20241231,预减,-68.2,-60.06,4300.0,5400.0,13521.63,20250123,预计:净利润4300-5400,公司2024年业绩较上年同期下降的主要原因：一是2024年公司新能源装机规模达到223.4万千瓦，同比增加45.06%，因新能源装机规模大幅增加，生产运营费用增加，致使发电业务毛利下降；二是对外投资增加，融资规模相应增加，导致财务费用增长；三是新疆区域报告期内电网消纳负荷增量有限，同时因市场电价变动的影响，电费结算单价下降。,0
001258.SZ,20220705,20220630,略增,3.25,11.9,7562.0,8196.0,7104.4279,20220705,预计:净利润7562-8196,2022年1-6月，公司经营情况预计不会发生重大变化，经营业绩稳定。根据公司过往经营状况以及各发电项目执行的上网电价、市场化交易合同电量、计划发电量及上网电量数据，并结合当前市场、行业的发展动态，并以2022年1-3月的经营情况为基础，基于谨慎性原则进行经营业绩预测。,1
001258.SZ,20220705,20220630,略增,3.25,11.9,7562.0,8196.0,7104.4279,20220705,预计净利润7562-8196万,2022年1-6月，公司经营情况预计不会发生重大变化，经营业绩稳定。根据公司过往经营状况以及各发电项目执行的上网电价、市场化交易合同电量、计划发电量及上网电量数据，并结合当前市场、行业的发展动态，并以2022年1-3月的经营情况为基础，基于谨慎性原则进行经营业绩预测。,0
