ts_code,ann_date,end_date,type,p_change_min,p_change_max,net_profit_min,net_profit_max,last_parent_net,first_ann_date,summary,change_reason,update_flag
001270.SZ,20260129,20251231,扭亏,405.29,498.48,9500.0,12400.0,-3111.79,20260129,预计:净利润9500-12400,"伴随下游行业回暖、需求持续增长，公司发挥技术积淀优势，凭借良好行业口碑巩固客户合作关系，积极拓展业务布局，取得显著成效。报告期内，依托各核心业务板块订单的稳步落地与批量交付的有序推进，公司营业收入规模较上年同期预计显著增长，盈利能力稳步改善，经营效益实现大幅提升。2025年年度营业收入预计为38,000万元-43,500万元，归属于上市公司股东的净利润预计为9,500万元-12,400万元，较上年同期扭亏为盈。",0
001270.SZ,20250710,20250630,扭亏,297.67,371.8,4800.0,6600.0,-2428.27,20250710,预计:净利润4800-6600,"报告期内，公司营业收入规模较上年同期预计显著增长，经营效益大幅提升。2025年半年度归属于上市公司股东的净利润预计为4,800万元–6,600万元，扣除非经常性损益后的净利润预计为4,500万元–6,300万元，较上年同期扭亏为盈。（一）行业需求快速复苏，公司业务布局成效显著受益于下游市场需求持续回暖且增速加快，叠加相控阵技术在各应用领域渗透率的稳步提升。公司把握市场机遇，基于公司的技术积累和行业口碑的建立，与客户合作关系日渐巩固，积极拓展业务布局并取得显著成效。报告期内，公司在手订单及重大项目数量均实现增长，公司在多个核心业务领域的重点项目正按计划陆续进入批量交付阶段。随着项目计划快速推进以及持续性的需求支撑，为公司长期收入规模的扩大提供了坚实基础。（二）经营效益持续向好，产品竞争力持续提升公司通过持续提升研发效率，降低研发成本，有效的提高了预研项目的成功率和产品转化率。同时，自动化程度的提高与产能的大幅扩张带来了显著的规模效应，推动公司成本费用持续摊薄。公司研发团队通过创新技术及新工艺研发的新一代T/R芯片，在集成度提升、功耗优化与成本控制方面实现突破，进一步强化了相控阵雷达、卫星通信等领域的核心技术壁垒，以技术优势加速市场渗透，公司产品的综合竞争力不断增强。公司2025年第一季度已成功实现营业收入同比高速增长，并实现扭亏为盈。2025年第二季度将延续业务发展势头，较上年同期预计继续保持营业收入和净利润的高速增长态势，公司积极采取的一系列应对措施加快推进业务发展取得显著成效。公司经营团队保持坚定信心，并已制定详尽的全年经营计划。一方面，公司将继续紧跟市场需求与技术趋势，持续加大研发投入力度，拓展新兴应用市场；发挥成本管控优势，进一步优化供应链管理，深化自动化应用，巩固和扩大竞争优势。另一方面，公司将持续保障高效交付，已提前规划并落实产能布局，全面提升生产与测试效率，确保客户订单的及时、高质量交付。基于上半年的坚实基础和下半年的周密部署，公司正推动全年经营规模的持续扩大，并致力于实现盈利高水平，确保年度经营目标的圆满达成。",0
001270.SZ,20250409,20250331,扭亏,281.17,331.49,2700.0,3450.0,-1490.33,20250409,预计:净利润2700-3450,"（一）公司积极推进项目订单生产交付，报告期内营收规模大幅增加，净利润同比扭亏为盈报告期内，行业需求恢复加快，公司持续拓展业务布局，在手订单及项目显著增加，公司积极推进项目订单生产交付，实现营业收入预计为9,000万元-9,500万元，较上年同期1,977.60万元大幅增长，同比创历史新高；归属于上市公司股东的净利润预计为2,700万元-3,450万元，扣除非经常性损益后的净利润预计为2,600万元-3,300万元，较上年同期扭亏为盈。报告期内，公司营收及利润大幅上升，主要受益于需求大幅增加新增订单大幅增长，产品价格体系稳定及销售规模扩大带来的成本优势，报告期内毛利及毛利率均有提升。（二）公司在手项目订单显著增加，业务拓展取得显著成效公司在星载领域继续保持领先优势，多系列型号遥感卫星项目进入批量交付阶段，根据客户需求计划，将于2025年第二季度及下半年交付确认；机载领域随着公司中标项目的批量供应，近年来营收规模也快速起量，报告期内客户陆续下达了新的需求订单及合同，公司积极安排产能进行生产交付，该领域营收规模保持了阶梯式的高速增长，公司在机载型号装备中的批量供应为后续获取新的项目订单奠定了坚实基础。同时，在低轨通信卫星领域，公司为下一代低轨通信卫星及地面配套设备新研了多款新产品，目前已根据客户需求备货，2025年按计划进行批量交付；在地面领域，前期因需求延期等原因，公司产品规模受到影响，目前下游需求计划在陆续落地，公司已与客户沟通项目需求生产计划，按照客户要求进行备货及生产交付。（三）公司持续提高研发水平效率，提高产品竞争力2025年公司第一季度毛利率较上年同期已大幅回升。（四）公司测试自动化升级，规模效应明显，实现降本增效在生产测试环节，公司持续通过提高自动化测试能力、优化工艺流程等方式实现降本增效。近年来公司产品生产量及销售量实现高增长，且公司自动化程度提高及产能大幅增加带来规模效应，公司成本费用将持续摊薄，有利于进一步提高公司产品成本竞争力。",0
001270.SZ,20250119,20241231,首亏,-145.16,-123.84,-3600.0,-1900.0,7970.79,20250119,预计:净利润-3600--1900,"（一）受行业需求延期影响，报告期内营收规模减少公司产品主要应用于各领域型号装备中，因装备生产周期长，公司受用户的需求及采购计划下达时间等因素的影响较大。报告期内，受到下游用户项目招标延期、客户端资金计划、相关项目审批周期延长导致交付验收延迟等因素的影响，公司产品交付验收进度低于预期。虽自2024年第三季度起下游用户需求已在陆续恢复，但在报告期内，上述因素对公司收入规模及净利润仍造成了一定的冲击。公司2024年营业收入比上年下降，导致公司毛利减少。（二）计提的应收账款信用减值损失增加对净利润影响较大公司客户主要为大型集团下属企业及院所，由于客户存在根据经费、采购资金预算管理等安排货款结算的情况，且内部付款审批流程较长、资金结算程序较为复杂，以致客户账期较长，公司应收款项规模增加，2024年公司拟计提的预期信用减值损失较上年同期增加3,000余万元，导致公司2024年利润总额减少约5,000余万元。公司的主要客户资信良好，应收账款安全性相对较高，预计不能收回款项的概率较低。公司与行业内主力客户保持着长期合作关系，也在积极持续与客户充分沟通，优化应收账款管理机制。（三）公司持续加大研发投入，研发费用同比增加报告期内，公司继续加大研发投入，研发费用相比上期增加，对净利润产生了一定的影响，公司研发投入增长较快主要系承担多领域新装备研发需求，根据客户提出的项目需求及技术要求进行产品研发，设计并试制出满足技术指标要求的芯片，为项目产品批量供应提供技术储备，为公司后续发展奠定基础。",0
001270.SZ,20240711,20240630,首亏,-143.3306,-130.3314,-2800.0,-1960.0,6461.95,20240711,预计:净利润-2800--1960,"报告期内，因受下游用户需求计划影响，公司交付的项目进度较慢，营业收入比上年同期下降约9,000万元；同时因应收账款账龄的延长导致计提的预期信用减值损失较上年同期增加约1,600万元、公司研发费用与上年同期相比增加约1,300万元，因此公司2024年半年度归属于上市公司股东的净利润预计亏损。随着公司业务规模的增长，公司应收账款总额增长较快，公司应收账款主要来源于国家大型集团科研院所等优质客户，应收账款安全性相对较高，公司也积极持续与客户充分沟通，优化应收账款管理机制。另外，公司研发投入增长较快主要系公司持续加大研发投入，承担多领域新装备研发需求，持续开展芯片核心技术攻关，以不断推进产品创新、丰富产品型号，满足客户产品高频化、高集成度、轻量化、多功能化的技术需求，推动公司可持续发展。2024年公司第二季度毛利率预计约为61%，毛利率较2024年第一季度已大幅回升。公司将继续通过提升研发水平、提高自动化测试能力、优化工艺流程等方式进行降本增效。公司将积极应对产业政策调整、推进研发项目实施、提升经营效益。目前公司在手项目70多个，下游用户需求处于恢复状态，根据客户生产计划要求，公司2024年生产交付任务主要集中于下半年，公司将加快进度完成各领域项目的生产交付。同时，公司将持续聚焦主业，丰富产品结构，加大市场开发与新领域拓展，加快落实提升经营业绩的各项工作。",1
001270.SZ,20240711,20240630,首亏,-143.3306,-130.3314,-2800.0,-1960.0,6461.95,20240711,预计:净利润-2800--1960,"报告期内，因受下游用户需求计划影响，公司交付的项目进度较慢，营业收入比上年同期下降约9,000万元；同时因应收账款账龄的延长导致计提的预期信用减值损失较上年同期增加约1,600万元、公司研发费用与上年同期相比增加约1,300万元，因此公司2024年半年度归属于上市公司股东的净利润预计亏损。随着公司业务规模的增长，公司应收账款总额增长较快，公司应收账款主要来源于国家大型集团科研院所等优质客户，应收账款安全性相对较高，公司也积极持续与客户充分沟通，优化应收账款管理机制。另外，公司研发投入增长较快主要系公司持续加大研发投入，承担多领域新装备研发需求，持续开展芯片核心技术攻关，以不断推进产品创新、丰富产品型号，满足客户产品高频化、高集成度、轻量化、多功能化的技术需求，推动公司可持续发展。2024年公司第二季度毛利率预计约为61%，毛利率较2024年第一季度已大幅回升。公司将继续通过提升研发水平、提高自动化测试能力、优化工艺流程等方式进行降本增效。公司将积极应对产业政策调整、推进研发项目实施、提升经营效益。目前公司在手项目70多个，下游用户需求处于恢复状态，根据客户生产计划要求，公司2024年生产交付任务主要集中于下半年，公司将加快进度完成各领域项目的生产交付。同时，公司将持续聚焦主业，丰富产品结构，加大市场开发与新领域拓展，加快落实提升经营业绩的各项工作。",0
001270.SZ,20220516,20220630,略增,8.34,25.68,5000.0,5800.0,4614.94,20220516,预计:净利润5000-5800,2022年1-6月，公司经营业绩同比呈增长趋势，主要原因系基于公司的技术积累和行业口碑的建立，与客户合作关系日渐巩固，公司参与的多个研制项目陆续进入量产阶段，产品结构逐渐丰富，不仅拓展了在星载领域产品应用的卫星型号数量，同时在地面、舰载、车载等应用领域的产品数量亦有所增长。上述2022年1-6月业绩预计中的相关财务数据为公司初步测算结果，预计数不代表公司最终可实现收入和净利润，亦不构成公司盈利预测。,1
001270.SZ,20220516,20220630,略增,8.34,25.68,5000.0,5800.0,4614.94,20220516,预计净利润5000-5800万,2022年1-6月，公司经营业绩同比呈增长趋势，主要原因系基于公司的技术积累和行业口碑的建立，与客户合作关系日渐巩固，公司参与的多个研制项目陆续进入量产阶段，产品结构逐渐丰富，不仅拓展了在星载领域产品应用的卫星型号数量，同时在地面、舰载、车载等应用领域的产品数量亦有所增长。上述2022年1-6月业绩预计中的相关财务数据为公司初步测算结果，预计数不代表公司最终可实现收入和净利润，亦不构成公司盈利预测。,0
