ts_code,ann_date,end_date,type,p_change_min,p_change_max,net_profit_min,net_profit_max,last_parent_net,first_ann_date,summary,change_reason,update_flag
001335.SZ,20250321,20250331,略增,13.26,29.84,2050.0,2350.0,1809.93,20250321,预计净利润2050-2350万,"公司2025年1-3月预计实现营业收入34,000.00万元至37,000.00万元，同比增长6.94%至16.37%，主要受益于收入增长且毛利率提升影响，公司2025年1-3月预计实现扣除非经常性损益后归属于母公司股东的净利润2,050.00万元至2,350.00万元，同比增长18.23%至35.53%。",1
001335.SZ,20250321,20250331,略增,13.26,29.84,2050.0,2350.0,1809.93,20250321,预计:净利润2050-2350,"公司2025年1-3月预计实现营业收入34,000.00万元至37,000.00万元，同比增长6.94%至16.37%，主要受益于收入增长且毛利率提升影响，公司2025年1-3月预计实现扣除非经常性损益后归属于母公司股东的净利润2,050.00万元至2,350.00万元，同比增长18.23%至35.53%。",0
001335.SZ,20250321,20241231,略增,21.76,21.76,10722.0,10722.0,8806.18,20250321,预计净利润10722万,"公司2024年度预计实现营业收入140,615.63万元，同比增长31.57%，其中主营业务收入138,078.82万元，占比98.20%，得益于公司全球化布局，境内外市场收入均实现较大幅度增长；主要受益于收入增长影响，公司2024年度预计实现扣除非经常性损益后归属于母公司股东的净利润10,549.58万元，同比增长26.44%。",1
001335.SZ,20250321,20241231,略增,21.76,21.76,10722.0,10722.0,8806.18,20250321,预计:净利润10722,"公司2024年度预计实现营业收入140,615.63万元，同比增长31.57%，其中主营业务收入138,078.82万元，占比98.20%，得益于公司全球化布局，境内外市场收入均实现较大幅度增长；主要受益于收入增长影响，公司2024年度预计实现扣除非经常性损益后归属于母公司股东的净利润10,549.58万元，同比增长26.44%。",0
001335.SZ,20250321,20240331,略增,13.26,29.84,2050.0,2350.0,1809.93,20250321,预计净利润2050-2350万,"公司2025年1-3月预计实现营业收入34,000.00万元至37,000.00万元，同比增长6.94%至16.37%，主要受益于收入增长且毛利率提升影响，公司2025年1-3月预计实现扣除非经常性损益后归属于母公司股东的净利润2,050.00万元至2,350.00万元，同比增长18.23%至35.53%。",0
