ts_code,ann_date,end_date,type,p_change_min,p_change_max,net_profit_min,net_profit_max,last_parent_net,first_ann_date,summary,change_reason,update_flag
001326.SZ,20260131,20251231,预减,-77.42,-70.65,2288.0,2974.0,10132.46,20260131,预计:净利润2288-2974,报告期内，公司归属于上市公司股东的净利润同比减少的主要原因系：报告期内，受美国关税政策等贸易摩擦的冲击，公司积极布局海外生产基地，供应链出海，供应链成本增加，同时，叠加行业竞争加剧等因素，公司主要产品毛利率出现下滑，利润空间受到压缩；此外，受贸易摩擦等的影响，公司于2024年投用的中山生产基地暂未形成最佳规模效应，固定资产新增金额较大推高单位产品固定成本；加之公司大力引进优秀人才、加码研发、提升生产自动化水平并布局充电桩和储能新赛道带来的期间费用有所增加，公司2025年预计实现归属于上市公司股东的净利润与上年同期相比，出现较大降幅。,1
001326.SZ,20260131,20251231,预减,-77.42,-70.65,2288.0,2974.0,10132.46,20260131,预计:净利润2288-2974,报告期内，公司归属于上市公司股东的净利润同比减少的主要原因系：报告期内，受美国关税政策等贸易摩擦的冲击，公司积极布局海外生产基地，供应链出海，供应链成本增加，同时，叠加行业竞争加剧等因素，公司主要产品毛利率出现下滑，利润空间受到压缩；此外，受贸易摩擦等的影响，公司于2024年投用的中山生产基地暂未形成最佳规模效应，固定资产新增金额较大推高单位产品固定成本；加之公司大力引进优秀人才、加码研发、提升生产自动化水平并布局充电桩和储能新赛道带来的期间费用有所增加，公司2025年预计实现归属于上市公司股东的净利润与上年同期相比，出现较大降幅。,0
001326.SZ,20250715,20250630,预减,-82.39,-77.57,1345.0,1713.0,7635.74,20250715,预计:净利润1345-1713,报告期内，公司归属于上市公司股东的净利润同比减少的主要原因系：（1）照明行业竞争加剧，公司产品价格有所降低，与此同时，公司积极布局海外生产基地，供应链出海、供应链成本增加，导致公司主要产品毛利率有所下降，利润空间受到压缩；（2）2024年公司中山生产基地投入使用，固定资产新增金额较大，由于产能存在爬坡以及产品线存在调试过程，尚未形成最佳规模效应，导致公司单位产品承担的固定成本有所增加；（3）公司努力适应新形势，不遗余力抓好经营，坚持产品研发创新，推动产品向智能化方向迭代升级；同时，加快推进海内外生产基地建设、不断提升生产自动化水平，大力引进优秀人才，导致管理费用较去年同期有较大幅度上升，公司利润水平下降；（4）公司通过全资子公司深圳市海搏电子有限公司积极在新赛道（充电桩和储能业务）开展布局，努力打造公司的第二增长曲线。目前该业务尚处于发展期，前期投入较多，相关业务尚未形成规模化营收及利润贡献，较大的研发投入、市场开拓费用及固定资产投入等成本支出对公司整体净利润造成了阶段性影响，导致净利润出现下滑。,0
001326.SZ,20231108,20231231,续盈,-14.35,4.27,11500.0,14000.0,13426.95,20231108,预计:净利润11500-14000,"随着收入的稳定增长，预计2023年全年净利润规模较上年同期将整体保持稳定，但由于：（1）人民币汇率形成机制进一步市场化，发行人无法准确预判未来汇率波动情况，因此发行人2023年业绩预计未包括汇兑损益的影响；（2）2022年度净利润已包含汇兑收益的影响，使得2022年度同期净利润基数较高，若剔除2022年汇兑收益2,838.72万元的影响，发行人2023年度净利润同比变动区间为8.61%~32.22%，与收入变动趋势一致。（3）目前美元兑人民币汇率已处于近期高位，不排除四季度美元兑人民币汇率发生较大波动，冲抵一部分汇兑收益。综上，出于谨慎性考虑，发行人预计2023年全年净利润规模较上年同期将整体保持稳定。",1
001326.SZ,20231108,20231231,续盈,-14.35,4.27,11500.0,14000.0,13426.95,20231108,预计:净利润11500-14000,"随着收入的稳定增长，预计2023年全年净利润规模较上年同期将整体保持稳定，但由于：（1）人民币汇率形成机制进一步市场化，发行人无法准确预判未来汇率波动情况，因此发行人2023年业绩预计未包括汇兑损益的影响；（2）2022年度净利润已包含汇兑收益的影响，使得2022年度同期净利润基数较高，若剔除2022年汇兑收益2,838.72万元的影响，发行人2023年度净利润同比变动区间为8.61%~32.22%，与收入变动趋势一致。（3）目前美元兑人民币汇率已处于近期高位，不排除四季度美元兑人民币汇率发生较大波动，冲抵一部分汇兑收益。综上，出于谨慎性考虑，发行人预计2023年全年净利润规模较上年同期将整体保持稳定。",0
001326.SZ,20231020,20230930,略增,6.99,12.62,11400.0,12000.0,10655.28,20231020,预计:净利润11400-12000,,1
001326.SZ,20231020,20230930,略增,6.99,12.62,11400.0,12000.0,10655.28,20231020,预计:净利润11400-12000,,0
