ts_code,ann_date,end_date,type,p_change_min,p_change_max,net_profit_min,net_profit_max,last_parent_net,first_ann_date,summary,change_reason,update_flag
002073.SZ,20250119,20241231,预增,47.08,59.09,49000.0,53000.0,33314.97,20250119,预计:净利润49000-53000,公司受益于国内轮胎企业海外投资的热潮，橡胶装备业务保持稳步增长。报告期内，公司持续强化研发投入，秉持创新驱动理念，不断推出新产品与新技术，业务订单保持增长；对已签单项目，公司推进签单项目管理机制，加强质量流程管控，产品品质不断增强，随着项目交付能力的提升，橡胶装备业务营收规模及盈利能力提升。,0
002073.SZ,20241012,20240930,预增,57.42,71.73,33000.0,36000.0,20963.14,20241012,预计:净利润33000-36000,公司受益于国内轮胎企业海外投资的热潮，橡胶装备业务保持稳步增长。报告期内，公司持续强化研发投入，不断推出新产品、新技术，业务订单保持增长；对已签单项目，公司推进签单项目管理机制，加强质量流程管控，产品品质不断增强，随着项目交付能力的提升，橡胶装备业务营收规模及盈利能力提升。另外，公司橡胶新材料业务的产销规模增加，产品结构改善后毛利率水平提升，新材料业务盈利能力也同步增长。,0
002073.SZ,20240711,20240630,预增,89.12,120.64,18000.0,21000.0,9517.8,20240711,预计:净利润18000-21000,报告期内公司受益于轮胎企业海外投资的热潮，橡胶机械业务保持稳步增长，公司重视产品品质的提升，升级供应链平台能力，设备项目交付效率提升，营收规模增长，橡胶机械业务盈利能力提升。另外，公司橡胶新材料业务的产销规模增加，产品结构改善后毛利率水平提升，新材料业务盈利能力较同期也同步增长。,1
002073.SZ,20240711,20240630,预增,89.12,120.64,18000.0,21000.0,9517.8,20240711,预计:净利润18000-21000,报告期内公司受益于轮胎企业海外投资的热潮，橡胶机械业务保持稳步增长，公司重视产品品质的提升，升级供应链平台能力，设备项目交付效率提升，营收规模增长，橡胶机械业务盈利能力提升。另外，公司橡胶新材料业务的产销规模增加，产品结构改善后毛利率水平提升，新材料业务盈利能力较同期也同步增长。,0
002073.SZ,20240117,20231231,预增,52.97,77.64,31000.0,36000.0,20265.16,20240117,预计:净利润31000-36000,报告期内，公司持续进行研发，丰富并改善产品结构加速工艺装备智能升级，提升产品品质和交付效率，客户认可度与市场占有率不断提升，橡胶装备业务持续发展，规模进一步提升。另外，公司加大对新产品、新技术等方面的研发投入，仍然保持对新兴业务的战略培育和扶持，橡胶新材料业务、锂电设备业务的销量、业绩均增长明显，获得行业、市场和客户的广泛认可。,1
002073.SZ,20240117,20231231,预增,52.97,77.64,31000.0,36000.0,20265.16,20240117,预计:净利润31000-36000,报告期内，公司持续进行研发，丰富并改善产品结构加速工艺装备智能升级，提升产品品质和交付效率，客户认可度与市场占有率不断提升，橡胶装备业务持续发展，规模进一步提升。另外，公司加大对新产品、新技术等方面的研发投入，仍然保持对新兴业务的战略培育和扶持，橡胶新材料业务、锂电设备业务的销量、业绩均增长明显，获得行业、市场和客户的广泛认可。,0
002073.SZ,20230714,20230630,预增,60.76,101.98,7800.0,9800.0,4851.93,20230714,预计:净利润7800-9800,"报告期内，业绩同向上升的主要原因如下：1．橡胶新材料业务、新能源行业智能装备业务增长明显，公司持续投入研发，提升产品品质和交付效率，获得行业、市场和客户的广泛认可。同时，公司持续推进产品标准化、模块化的应用，加速工艺装备智能升级,不断丰富产品功能，橡胶装备业务稳定发展。2．公司资产配置效率提升，其中处置子公司青岛软控智能装备有限公司影响约1,833万元。",1
002073.SZ,20230714,20230630,预增,60.76,101.98,7800.0,9800.0,4851.93,20230714,预计:净利润7800-9800,"报告期内，业绩同向上升的主要原因如下：1．橡胶新材料业务、新能源行业智能装备业务增长明显，公司持续投入研发，提升产品品质和交付效率，获得行业、市场和客户的广泛认可。同时，公司持续推进产品标准化、模块化的应用，加速工艺装备智能升级,不断丰富产品功能，橡胶装备业务稳定发展。2．公司资产配置效率提升，其中处置子公司青岛软控智能装备有限公司影响约1,833万元。",0
002073.SZ,20230104,20221231,预增,33.56,54.65,19000.0,22000.0,14225.7,20230104,预计:净利润19000-22000,"报告期内，橡胶装备业务保持增长，公司持续推进产品标准化、模块化的应用，加速工艺装备智能升级,不断丰富产品功能，提升产品品质和交付效率。同时，公司持续加大对新产品、新技术等方面的研发投入，产品结构不断丰富、优化，运营效率逐步改善，盈利能力不断提升。另外，公司仍然保持对新兴业务的战略培育和扶持，持续投入研发，橡胶新材料业务、锂电设备业务的订单、业绩均增长明显，获得行业、市场和客户的广泛认可。",1
002073.SZ,20230104,20221231,预增,33.56,54.65,19000.0,22000.0,14225.7,20230104,预计净利润19000-22000万,"报告期内，橡胶装备业务保持增长，公司持续推进产品标准化、模块化的应用，加速工艺装备智能升级,不断丰富产品功能，提升产品品质和交付效率。同时，公司持续加大对新产品、新技术等方面的研发投入，产品结构不断丰富、优化，运营效率逐步改善，盈利能力不断提升。另外，公司仍然保持对新兴业务的战略培育和扶持，持续投入研发，橡胶新材料业务、锂电设备业务的订单、业绩均增长明显，获得行业、市场和客户的广泛认可。",0
002073.SZ,20220117,20211231,预增,41.93,62.96,13500.0,15500.0,9511.55,20220117,预计:净利润13500-15500,报告期内，公司克服疫情的不利影响，橡胶装备业务订单保持增长，公司持续推进全系列产品、全流程、全要素模块化研发与制造，提升产品品质和交付效率，得到客户认可。同时公司前期不断加大对新产品、新技术等方面的研发投入，产品结构不断优化，资产运营效率改善，盈利能力提升。另外，公司加大对新兴业务的战略培育和扶持，持续研发投入，并与高端客户建立了长期稳定的合作关系，订单、业绩均增长明显，获得行业、市场和客户的广泛认可。,1
002073.SZ,20220117,20211231,预增,41.93,62.96,13500.0,15500.0,9511.55,20220117,预计净利润13500-15500万,报告期内，公司克服疫情的不利影响，橡胶装备业务订单保持增长，公司持续推进全系列产品、全流程、全要素模块化研发与制造，提升产品品质和交付效率，得到客户认可。同时公司前期不断加大对新产品、新技术等方面的研发投入，产品结构不断优化，资产运营效率改善，盈利能力提升。另外，公司加大对新兴业务的战略培育和扶持，持续研发投入，并与高端客户建立了长期稳定的合作关系，订单、业绩均增长明显，获得行业、市场和客户的广泛认可。,0
002073.SZ,20211012,20210930,预增,248.78,295.29,7500.0,8500.0,2150.34,20211012,预计:净利润7500-8500,报告期内，公司橡胶装备业务订单如期交付，营业收入增加；同时公司不断加大对新产品、新技术等方面的研发投入，公司产品结构不断优化，盈利能力提升。,1
002073.SZ,20211012,20210930,预增,248.78,295.29,7500.0,8500.0,2150.34,20211012,预计净利润7500-8500万,报告期内，公司橡胶装备业务订单如期交付，营业收入增加；同时公司不断加大对新产品、新技术等方面的研发投入，公司产品结构不断优化，盈利能力提升。,0
002073.SZ,20210708,20210630,预增,347.19,526.06,2500.0,3500.0,559.05,20210708,预计:净利润2500-3500,"报告期内,公司主营业务订单如期交付,营业收入增加;同时公司产品结构不断优化,资产运营效率持续改善,盈利能力提升.",1
002073.SZ,20210708,20210630,预增,347.19,526.06,2500.0,3500.0,559.05,20210708,预计净利润2500-3500万,"报告期内,公司主营业务订单如期交付,营业收入增加;同时公司产品结构不断优化,资产运营效率持续改善,盈利能力提升.",0
002073.SZ,20210415,20210331,扭亏,113.29,118.61,500.0,700.0,-3762.05,20210415,预计:净利润500-700,"随着国内新冠肺炎疫情的有效控制,橡胶轮胎行业产销业务增长明显,轮胎企业资产投资加快,公司主营橡胶装备业务增长明显.同时公司不断加大对新产品,新技术等方面的研发投入,产品结构不断优化,资产运营效率改善,盈利能力提升.",1
002073.SZ,20210415,20210331,扭亏,113.29,118.61,500.0,700.0,-3762.05,20210415,预计净利润500-700万,"随着国内新冠肺炎疫情的有效控制,橡胶轮胎行业产销业务增长明显,轮胎企业资产投资加快,公司主营橡胶装备业务增长明显.同时公司不断加大对新产品,新技术等方面的研发投入,产品结构不断优化,资产运营效率改善,盈利能力提升.",0
002073.SZ,20210128,20201231,略增,10.19,28.13,8600.0,10000.0,7804.86,20210128,预计净利润8600-10000万,"2020年国内轮胎制造企业产销增长明显,同时公司的新技术,新产品不断投放市场,得到客户认可,报告期内公司国内订单有较大幅度增长.另外,随着国内新冠肺炎疫情的有效控制,公司积极推进订单交付,业绩逐步提升.",0
002073.SZ,20200826,20200930,预减,-78.87,-69.01,1500.0,2200.0,7100.11,20200826,预计净利润1500-2200万,受新冠疫情影响，项目交付出现延期或暂缓，收入减少，利润影响较大。,0
002073.SZ,20200421,20200630,不确定,-115.3252,-84.6748,-1000.0,1000.0,6525.19,20200421,预计净利润-1000-1000万,受国内外疫情的影响，订单量减少，产品交货延期，收入减少，影响较大。,0
002073.SZ,20200414,20200331,首亏,-321.1014,-265.826,-4000.0,-3000.0,1809.12,20200414,预计净利润-4000~-3000万,"报告期内,受新冠肺炎疫情影响,公司复工复产延后,供应链供货不畅,客户订单项目交付受阻,导致公司当期营业收入下降,归属于上市公司股东的净利润亏损.随着国内新冠肺炎疫情的有效控制,预计公司2020年第二季度业绩将逐步恢复。",0
