ts_code,ann_date,end_date,type,p_change_min,p_change_max,net_profit_min,net_profit_max,last_parent_net,first_ann_date,summary,change_reason,update_flag
002034.SZ,20210429,20210630,略增,30.77,39.49,30000.0,32000.0,22940.8,20210429,预计:净利润30000-32000,主要原因为公司上一年度投入运营的德清技改、台州三期、公安项目和青田项目，以及在本年度第二季度即将投运的汕头三期项目扩大了公司经营规模，并成为新的利润增长点。,1
002034.SZ,20210429,20210630,略增,30.77,39.49,30000.0,32000.0,22940.8,20210429,预计净利润30000-32000万,主要原因为公司上一年度投入运营的德清技改、台州三期、公安项目和青田项目，以及在本年度第二季度即将投运的汕头三期项目扩大了公司经营规模，并成为新的利润增长点。,0
002034.SZ,20210407,20210331,预增,52.38,64.1,13000.0,14000.0,8531.14,20210407,预计:净利润13000-14000,"公司预计2021年一季度归属于上市公司股东的净利润同比增长幅度较大,主要原因系舟山三期项目,德清技改项目,台州三期项目等新建扩建项目投产为公司带来了利润的增长.",1
002034.SZ,20210407,20210331,预增,52.38,64.1,13000.0,14000.0,8531.14,20210407,预计净利润13000-14000万,"公司预计2021年一季度归属于上市公司股东的净利润同比增长幅度较大,主要原因系舟山三期项目,德清技改项目,台州三期项目等新建扩建项目投产为公司带来了利润的增长.",0
002034.SZ,20201027,20201231,略增,16.67,28.83,48000.0,53000.0,41140.54,20201027,预计净利润48000-53000万,主要原因为公司上半年投入运营的舟山三期、德清技改、台州三期项目和下半年即将投运的公安项目和青田项目，扩大了公司经营规模，并成为新的利润增长点。,0
002034.SZ,20200812,20200930,略增,12.36,28.41,35000.0,40000.0,31149.83,20200812,预计净利润35000-40000万,主要原因为公司上半年投入运营的舟山三期、德清技改、台州三期项目和下半年即将投运的公安项目和青田项目，扩大了公司经营规模，并成为新的利润增长点。,0
