ts_code,ann_date,end_date,type,p_change_min,p_change_max,net_profit_min,net_profit_max,last_parent_net,first_ann_date,summary,change_reason,update_flag
002106.SZ,20210409,20210331,预增,123.83,146.21,15000.0,16500.0,6701.62,20210409,预计:净利润15000-16500,"2021年第一季度,公司中大尺寸电容式触摸屏全贴合产品,车载触摸屏,ITO导电玻璃,TFT-LCD等产品需求旺盛,为满足产品交付,公司春节假期安排加班生产,产品产销两旺;而上年同期,因春节放假及节后新冠病毒疫情影响公司部分员工无法返岗生产,生产线产能利用率较低.公司2021年第一季度中大尺寸电容式触摸屏全贴合产品,车载触摸屏,ITO导电玻璃,TFT-LCD等产品的产销量及销售收入均同比去年同期大幅增长,以及本期生产线产能利用率提升相应摊低产品固定成本,导致公司本期产品销售毛利同比大幅增长,因此,公司本期归属于上市公司股东的净利润同比大幅增长.",1
002106.SZ,20210409,20210331,预增,123.83,146.21,15000.0,16500.0,6701.62,20210409,预计净利润15000-16500万,"2021年第一季度,公司中大尺寸电容式触摸屏全贴合产品,车载触摸屏,ITO导电玻璃,TFT-LCD等产品需求旺盛,为满足产品交付,公司春节假期安排加班生产,产品产销两旺;而上年同期,因春节放假及节后新冠病毒疫情影响公司部分员工无法返岗生产,生产线产能利用率较低.公司2021年第一季度中大尺寸电容式触摸屏全贴合产品,车载触摸屏,ITO导电玻璃,TFT-LCD等产品的产销量及销售收入均同比去年同期大幅增长,以及本期生产线产能利用率提升相应摊低产品固定成本,导致公司本期产品销售毛利同比大幅增长,因此,公司本期归属于上市公司股东的净利润同比大幅增长.",0
002106.SZ,20210119,20201231,预增,50.0,60.0,42278.0,45097.0,28185.6,20210119,预计净利润42278-45097万,"2020年，公司中大尺寸电容式触摸屏产品需求旺盛，公司充分挖掘中大尺寸电容式触摸屏产品的产能潜力，中大尺寸电容式触摸屏全贴合产品销量及销售收入均较上年同期大幅增长，产品销售毛利大幅增加；同时，人民币兑美元汇率升值产生较大的汇兑损失，对公司经营业绩带来较大的不利影响；综上，公司2020年度经营业绩同比去年实现较大幅度增长。公司2020年度非经常性损益对净利润的影响金额约5,400万元（2019年度的影响金额为4,849万元），主要是收到NPS设备仲裁案返还部分设备款及收到政府补助影响所致。",0
002106.SZ,20200710,20200630,预增,130.88,151.87,22000.0,24000.0,9528.6,20200710,预计净利润22000-24000万,2020年上半年，受全球新冠肺炎疫情影响，居家办公与在线教育相应带动笔记本电脑需求旺盛，公司充分挖掘中大尺寸电容式触摸屏产品产能潜力，产出得到较大提升，中大尺寸电容式触摸屏全贴合产品销量及销售收入均较上年同期大幅增长，生产效率提升，产品销售毛利大幅增加，对公司报告期的经营业绩带来积极贡献。,0
002106.SZ,20200414,20200331,预增,646.57,770.99,6000.0,7000.0,803.68,20200414,预计净利润6000-7000万,"2020年第一季度,公司积极采取措施,努力克服新冠肺炎疫情带来的不利影响,全力复工复产交付产品订单.与去年同期相比,本报告期公司中大尺寸电容式触摸屏全贴合产品销量及销售收入增长,生产效率提升,产品销售毛利相应增加;此外,本报告期财务费用较去年同期减少约4,000多万元,主要是本报告期美元兑人民币汇率升值产生汇兑收益,而上年同期美元兑人民币汇率贬值产生汇兑损失影响所致.",0
