ts_code,ann_date,end_date,type,p_change_min,p_change_max,net_profit_min,net_profit_max,last_parent_net,first_ann_date,summary,change_reason,update_flag
002129.SZ,20220415,20220331,预增,132.71,151.18,126000.0,136000.0,54145.2,20220415,预计:净利润126000-136000,"公司2022年第一季度预计实现营业收入1,280,000万元～1,380,000万元，同比增长71.52%～84.92%，预计实现归属于上市公司股东的净利润126,000万元～136,000万元，同比增长132.71%～151.18%。公司业绩大幅增长的主要原因：1、公司半导体光伏业务板块：（1）银川六期产能逐步释放，210产品先进产能加速提升，产品结构优化升级，出货占比不断提升，综合成本不断降低，先进产能产销最大化，保障战略产品市场规模优势，提高整体盈利能力；（2）通过持续技术提升和工艺进步，有效降低了生产成本，较大程度保障公司盈利能力。在晶体环节，单台月产持续提高，单位产品硅料消耗率大幅度领先行业水平；在晶片环节，通过细线化、薄片化工艺改善，硅片出片率及A品率大幅提升，单位公斤出片数行业显著领先；（3）利用210产品差异化及成本优势，缓解下游客户成本压力，提升自身和客户竞争力；（4）公司通过长期构建的良好供应链合作关系，提升了运营稳定性，较好地保障了公司产销规模提升。2、公司半导体材料业务产能规模持续提升，8-12英寸抛光片、外延片出货量加速攀升，提升产品供应能力，产销规模同比提升明显；特色工艺+先进制程双路径发展，推动技术研发与客户认证，产品维度加速升级，加快新产品布局；同时半导体市场快速增量，客户结构持续优化，与战略客户协同成长，与多家国际芯片厂商签订长期战略合作协议，推进与战略客户的合作优势，实现出货快速增量。3、随着工业4.0及柔性制造智能工厂生产方式在公司各产业板块的作业流程和作业场景的应用，报告期内，人均劳动生产率大幅提升、产品质量和一致性持续提升、原材辅料消耗得到有效改善，工厂运营成本持续下降；同时与上下游客户协同建立柔性化合作模式，降低交易成本，提升自身和客户竞争力；有力的推动了公司产品的产销规模和产品质量的提升。",1
002129.SZ,20220415,20220331,预增,132.71,151.18,126000.0,136000.0,54145.2,20220415,预计净利润126000-136000万,"公司2022年第一季度预计实现营业收入1,280,000万元～1,380,000万元，同比增长71.52%～84.92%，预计实现归属于上市公司股东的净利润126,000万元～136,000万元，同比增长132.71%～151.18%。公司业绩大幅增长的主要原因：1、公司半导体光伏业务板块：（1）银川六期产能逐步释放，210产品先进产能加速提升，产品结构优化升级，出货占比不断提升，综合成本不断降低，先进产能产销最大化，保障战略产品市场规模优势，提高整体盈利能力；（2）通过持续技术提升和工艺进步，有效降低了生产成本，较大程度保障公司盈利能力。在晶体环节，单台月产持续提高，单位产品硅料消耗率大幅度领先行业水平；在晶片环节，通过细线化、薄片化工艺改善，硅片出片率及A品率大幅提升，单位公斤出片数行业显著领先；（3）利用210产品差异化及成本优势，缓解下游客户成本压力，提升自身和客户竞争力；（4）公司通过长期构建的良好供应链合作关系，提升了运营稳定性，较好地保障了公司产销规模提升。2、公司半导体材料业务产能规模持续提升，8-12英寸抛光片、外延片出货量加速攀升，提升产品供应能力，产销规模同比提升明显；特色工艺+先进制程双路径发展，推动技术研发与客户认证，产品维度加速升级，加快新产品布局；同时半导体市场快速增量，客户结构持续优化，与战略客户协同成长，与多家国际芯片厂商签订长期战略合作协议，推进与战略客户的合作优势，实现出货快速增量。3、随着工业4.0及柔性制造智能工厂生产方式在公司各产业板块的作业流程和作业场景的应用，报告期内，人均劳动生产率大幅提升、产品质量和一致性持续提升、原材辅料消耗得到有效改善，工厂运营成本持续下降；同时与上下游客户协同建立柔性化合作模式，降低交易成本，提升自身和客户竞争力；有力的推动了公司产品的产销规模和产品质量的提升。",0
002129.SZ,20220128,20211231,预增,248.95,285.68,380000.0,420000.0,108899.54,20220128,预计:净利润380000-420000,"公司2021年度预计实现营业收入4,000,000万元～4,200,000万元，同比增长109.90%～120.39%，预计实现归属于上市公司股东的净利润380,000万元～420,000万元，同比增长248.95%～285.68%。公司业绩大幅增长的主要原因：1、公司半导体光伏210产品产能加速提升，持续巩固产业竞争力，利用210产品差异化及成本优势，缓解下游客户成本压力，提升自身竞争力；通过一系列技术进步，报告期内单台炉产效率业内领先，单位产品硅料消耗率同比下降明显，通过细线化、薄片化工艺改善，硅片出片率及A品率大幅提升，较大程度改善单位产品毛利；面对多晶硅原料价格波动，公司通过长期构建的良好供应链合作，并合理控制库存，较好地保障了公司生产运营。2、公司半导体材料业务通过加速新产线调试释放有效产能，提升产品供应能力，产销规模同比提升明显，产品结构进一步完善；加速推动技术研发与客户认证，产品维度快速升级，加快新产品布局；位于天津市、江苏宜兴市的新增投资项目顺利推进，同时加速品牌建设及全球化布局，为半导体业务加速发展奠定了基础。3、随着工业4.0及柔性制造智能工厂生产方式在公司各产业板块的作业流程和作业场景的应用，报告期内，人均劳动生产率大幅提升、产品质量和一致性持续提升、原材辅料消耗得到有效改善，工厂运营成本持续下降；同时与上下游客户协同建立柔性化合作模式，降低交易成本，提升自身和客户竞争力；有力的推动了公司产品的产销规模和产品质量的提升。",1
002129.SZ,20220128,20211231,预增,248.95,285.68,380000.0,420000.0,108899.54,20220128,预计净利润380000-420000万,"公司2021年度预计实现营业收入4,000,000万元～4,200,000万元，同比增长109.90%～120.39%，预计实现归属于上市公司股东的净利润380,000万元～420,000万元，同比增长248.95%～285.68%。公司业绩大幅增长的主要原因：1、公司半导体光伏210产品产能加速提升，持续巩固产业竞争力，利用210产品差异化及成本优势，缓解下游客户成本压力，提升自身竞争力；通过一系列技术进步，报告期内单台炉产效率业内领先，单位产品硅料消耗率同比下降明显，通过细线化、薄片化工艺改善，硅片出片率及A品率大幅提升，较大程度改善单位产品毛利；面对多晶硅原料价格波动，公司通过长期构建的良好供应链合作，并合理控制库存，较好地保障了公司生产运营。2、公司半导体材料业务通过加速新产线调试释放有效产能，提升产品供应能力，产销规模同比提升明显，产品结构进一步完善；加速推动技术研发与客户认证，产品维度快速升级，加快新产品布局；位于天津市、江苏宜兴市的新增投资项目顺利推进，同时加速品牌建设及全球化布局，为半导体业务加速发展奠定了基础。3、随着工业4.0及柔性制造智能工厂生产方式在公司各产业板块的作业流程和作业场景的应用，报告期内，人均劳动生产率大幅提升、产品质量和一致性持续提升、原材辅料消耗得到有效改善，工厂运营成本持续下降；同时与上下游客户协同建立柔性化合作模式，降低交易成本，提升自身和客户竞争力；有力的推动了公司产品的产销规模和产品质量的提升。",0
002129.SZ,20211015,20210930,预增,219.03,230.84,270000.0,280000.0,84632.41,20211015,预计:净利润270000-280000,"公司2021年前三季度预计实现营业收入2,800,000.00万元～3,000,000.00万元，同比增长109.32%～124.27%，预计实现归属于上市公司股东的净利润270,000.00万元～280,000.00万元，同比增长219.03%～230.84%。公司业绩大幅增长的主要原因：1、公司半导体光伏210产品规模提升加速、生产产品结构转型顺利，利用210产品差异化优势，缓解下游客户成本压力，提升自身竞争力；通过一系列技术进步，报告期单位产品硅料消耗率同比下降明显，硅片A品率大幅提升，较大程度改善单位产品毛利率；面对多晶硅原料价格的快速上涨，公司通过长期构建的良好供应链合作关系，较好地保障了公司产销规模提升。2、公司半导体材料业务通过加速新产线调试释放有效产能，提升交付率，产销规模同比提升明显，产品结构进一步完善；位于天津市、江苏宜兴市的新增投资项目顺利开展，为半导体业务加速发展奠定了基础。3、随着工业4.0生产方式在公司各产业板块的作业流程和作业场景的应用，报告期内，人均劳动生产率继续大幅度提升、产品质量和一致性持续提升、原材辅料消耗得到有效改善，工厂运营成本持续下降；同时与下游客户协同建立柔性化合作模式，降低交易成本，提升自身和客户竞争力；有力的推动了210产品的产销规模和产品质量的提升。",1
002129.SZ,20211015,20210930,预增,219.03,230.84,270000.0,280000.0,84632.41,20211015,预计净利润270000-280000万,"公司2021年前三季度预计实现营业收入2,800,000.00万元～3,000,000.00万元，同比增长109.32%～124.27%，预计实现归属于上市公司股东的净利润270,000.00万元～280,000.00万元，同比增长219.03%～230.84%。公司业绩大幅增长的主要原因：1、公司半导体光伏210产品规模提升加速、生产产品结构转型顺利，利用210产品差异化优势，缓解下游客户成本压力，提升自身竞争力；通过一系列技术进步，报告期单位产品硅料消耗率同比下降明显，硅片A品率大幅提升，较大程度改善单位产品毛利率；面对多晶硅原料价格的快速上涨，公司通过长期构建的良好供应链合作关系，较好地保障了公司产销规模提升。2、公司半导体材料业务通过加速新产线调试释放有效产能，提升交付率，产销规模同比提升明显，产品结构进一步完善；位于天津市、江苏宜兴市的新增投资项目顺利开展，为半导体业务加速发展奠定了基础。3、随着工业4.0生产方式在公司各产业板块的作业流程和作业场景的应用，报告期内，人均劳动生产率继续大幅度提升、产品质量和一致性持续提升、原材辅料消耗得到有效改善，工厂运营成本持续下降；同时与下游客户协同建立柔性化合作模式，降低交易成本，提升自身和客户竞争力；有力的推动了210产品的产销规模和产品质量的提升。",0
002129.SZ,20210715,20210630,预增,160.06,187.93,140000.0,155000.0,53832.74,20210715,预计:净利润140000-155000,"公司2021年半年度预计实现营业收入1,700,000.00万元～1,800,000.00万元，同比增长96.66%～108.23%，预计实现归属于上市公司股东的净利润预计140,000.00万元～155,000.00万元，同比增长160.06%～187.93%。公司业绩大幅增长的主要原因：1、半导体光伏业务板块：报告期内，（1）公司210产品规模提升加速、生产产品结构转型顺利。至报告期末，公司半导体光伏材料产能较2020年末提升超过55%至70GW，产销规模同比提升110%。（2）通过一系列技术进步，上半年单位产品硅料消耗率同比下降近2%，硅片A品率大幅提升，较大程度改善单位产品毛利率。（3）面对上半年多晶硅原料价格的快速上涨，公司通过长期构建的良好供应链合作关系，较好地保障了公司产销规模提升，此外，公司有效控制存货规模，降低未来经营风险。2、半导体业务板块：报告期内，公司半导体产销规模同比提升63%，产品结构进一步完善；位于天津市、江苏宜兴市的新增投资项目顺利开展，为半导体业务加速发展奠定了基础。3、现代制造业转型方面：随着工业4.0生产方式在公司各产业板块的作业流程和作业场景的应用，报告期内，人均劳动生产率继续大幅度提升、产品质量和一致性持续提升、原材辅料消耗得到有效改善，工厂运营成本持续下降；并有力的推动了210产品的产销规模和产品质量的提升。4、公司内部治理方面：在新体制和机制下，公司战略方向清晰，组织团队充满活力；内部各项经营工作强长板补短板，经营提质增效，全面提升竞争力。报告期内，公司各项决策事项流程优化、效率更高。2021年6月，公司发布混改后首份股权激励方案，并实施完毕用于股权激励的3.3亿元股票的回购，公司实现了从战略加速到机制完善的闭环，发展迈入新阶段.",1
002129.SZ,20210715,20210630,预增,160.06,187.93,140000.0,155000.0,53832.74,20210715,预计净利润140000-155000万,"公司2021年半年度预计实现营业收入1,700,000.00万元～1,800,000.00万元，同比增长96.66%～108.23%，预计实现归属于上市公司股东的净利润预计140,000.00万元～155,000.00万元，同比增长160.06%～187.93%。公司业绩大幅增长的主要原因：1、半导体光伏业务板块：报告期内，（1）公司210产品规模提升加速、生产产品结构转型顺利。至报告期末，公司半导体光伏材料产能较2020年末提升超过55%至70GW，产销规模同比提升110%。（2）通过一系列技术进步，上半年单位产品硅料消耗率同比下降近2%，硅片A品率大幅提升，较大程度改善单位产品毛利率。（3）面对上半年多晶硅原料价格的快速上涨，公司通过长期构建的良好供应链合作关系，较好地保障了公司产销规模提升，此外，公司有效控制存货规模，降低未来经营风险。2、半导体业务板块：报告期内，公司半导体产销规模同比提升63%，产品结构进一步完善；位于天津市、江苏宜兴市的新增投资项目顺利开展，为半导体业务加速发展奠定了基础。3、现代制造业转型方面：随着工业4.0生产方式在公司各产业板块的作业流程和作业场景的应用，报告期内，人均劳动生产率继续大幅度提升、产品质量和一致性持续提升、原材辅料消耗得到有效改善，工厂运营成本持续下降；并有力的推动了210产品的产销规模和产品质量的提升。4、公司内部治理方面：在新体制和机制下，公司战略方向清晰，组织团队充满活力；内部各项经营工作强长板补短板，经营提质增效，全面提升竞争力。报告期内，公司各项决策事项流程优化、效率更高。2021年6月，公司发布混改后首份股权激励方案，并实施完毕用于股权激励的3.3亿元股票的回购，公司实现了从战略加速到机制完善的闭环，发展迈入新阶段.",0
002129.SZ,20210410,20210331,预增,86.27,117.97,47000.0,55000.0,25232.81,20210410,预计:净利润47000-55000,"公司2021年第一季度预计实现营业收入700,000万元~760,000万元,同比增长54.99%~68.27%,预计实现归属于上市公司股东的净利润预计47,000万元~55,000万元,同比增长86.27%~117.97%.业绩增长的主要原因:1,公司光伏晶体制造和晶片制造围绕设备理论产能提升,产品质量升级和产品成本下降开展了持续的技术创新,厚积薄发形成了一系列自主知识产权的专利技术和know-how;同时进一步加速了在生产过程中全流程的工业4.0的应用和升级,始终保持全球同行业的领先水平.2,公司对行业发展方向及自身的发展路径具有清晰的判断和认知,全球首创的光伏G12硅片是平台型技术,产品优势明显,为光伏行业竞争提供“新赛道”,得到行业客户高度认同,并形成210单晶硅片产业生态联盟,引领光伏进入6.0时代.一季度光伏G12硅片产销逐月增长,盈利能力和市场竞争力逐月提升.3,公司在新体制和机制下优势初步显现,使得公司决策流程更短,速度显著加快,运行效率更高,市场反应更加敏捷,助力公司业绩提升.",1
002129.SZ,20210410,20210331,预增,86.27,117.97,47000.0,55000.0,25232.81,20210410,预计净利润47000-55000万,"公司2021年第一季度预计实现营业收入700,000万元~760,000万元,同比增长54.99%~68.27%,预计实现归属于上市公司股东的净利润预计47,000万元~55,000万元,同比增长86.27%~117.97%.业绩增长的主要原因:1,公司光伏晶体制造和晶片制造围绕设备理论产能提升,产品质量升级和产品成本下降开展了持续的技术创新,厚积薄发形成了一系列自主知识产权的专利技术和know-how;同时进一步加速了在生产过程中全流程的工业4.0的应用和升级,始终保持全球同行业的领先水平.2,公司对行业发展方向及自身的发展路径具有清晰的判断和认知,全球首创的光伏G12硅片是平台型技术,产品优势明显,为光伏行业竞争提供“新赛道”,得到行业客户高度认同,并形成210单晶硅片产业生态联盟,引领光伏进入6.0时代.一季度光伏G12硅片产销逐月增长,盈利能力和市场竞争力逐月提升.3,公司在新体制和机制下优势初步显现,使得公司决策流程更短,速度显著加快,运行效率更高,市场反应更加敏捷,助力公司业绩提升.",0
