ts_code,ann_date,end_date,type,p_change_min,p_change_max,net_profit_min,net_profit_max,last_parent_net,first_ann_date,summary,change_reason,update_flag
002101.SZ,20260415,20260331,首亏,-120.5862,-110.6144,-929.0,-479.0,4512.74,20260415,预计:净利润-929--479,"公司2026年第一季度预计实现营业收入191,036.00万元至199,978.00万元，同比下降4.72%至8.98%；预计实现归属于上市公司股东的净利润在-929.00万元至-479.00万元之间，实现归属于上市公司股东扣除非经常性损益后的净利润在-1,557.00万元至-1,157.00万元之间。2026年第一季度营业收入同比下降，归属于上市公司股东的净利润、扣除非经常性损益后的归母净利润出现亏损的主要原因如下：报告期内，因受汽车行业产销量下行、市场竞争加剧、原材料价格上涨、汇率波动以及公司新建项目产能爬坡期间成本费用率较高等多种因素叠加的影响，公司营业收入、经营利润较上年同期下降，2月份出现单月亏损。公司持续加大市场开拓和降本增效力度，季末营收逐步回升、利润转正，但报告期整体上仍未能消减前述不利因素的影响。",1
002101.SZ,20260415,20260331,首亏,-120.5862,-110.6144,-929.0,-479.0,4512.74,20260415,预计:净利润-929--479,"公司2026年第一季度预计实现营业收入191,036.00万元至199,978.00万元，同比下降4.72%至8.98%；预计实现归属于上市公司股东的净利润在-929.00万元至-479.00万元之间，实现归属于上市公司股东扣除非经常性损益后的净利润在-1,557.00万元至-1,157.00万元之间。2026年第一季度营业收入同比下降，归属于上市公司股东的净利润、扣除非经常性损益后的归母净利润出现亏损的主要原因如下：报告期内，因受汽车行业产销量下行、市场竞争加剧、原材料价格上涨、汇率波动以及公司新建项目产能爬坡期间成本费用率较高等多种因素叠加的影响，公司营业收入、经营利润较上年同期下降，2月份出现单月亏损。公司持续加大市场开拓和降本增效力度，季末营收逐步回升、利润转正，但报告期整体上仍未能消减前述不利因素的影响。",0
002101.SZ,20260116,20251231,略减,-17.87,-7.99,34100.0,38200.0,41519.05,20260116,预计:净利润34100-38200,"1、2025年，公司积极应对市场变化，持续加大市场开拓力度，进一步优化业务布局，全年预计实现营业收入在886,000万元-966,000万元，同比增加10.02%-19.95%。2、报告期内，因受行业竞争加剧、原材料价格上涨、关税增加、汇率波动、进项税额加计抵减减少等因素的影响，公司2025年度经营利润呈现下滑趋势，预计实现归属于上市公司股东的净利润在34,100万元-38,200万元之间，同比下降7.99%-17.87%；预计实现归属于上市公司股东扣除非经常性损益后的净利润在31,900万元-35,900万元之间，同比下降6.81%-17.20%。",0
002101.SZ,20240131,20231231,略减,-14.0505,-3.9514,40000.0,44700.0,46538.96,20240131,预计:净利润40000-44700,"公司2023年1-12月预计实现归属于上市公司股东的净利润在40,000万元–44,700万元之间，同比下降3.95%-14.05%；预计实现归属于上市公司股东扣除非经常性损益后的净利润在37,700万元–41,400万元之间，同比上升4.73%-15.01%。2023年度归属于上市公司股东的净利润同比下降、扣除非经常性损益后的归母净利润同比上升的主要原因如下：1、公司于上年同期完成了对原控股子公司广东宝龙汽车有限公司的股权转让，该股权转让事项对上年同期业绩产生正影响，导致归属于上市公司股东的净利润同比下降；若剔除该事项的影响，归属于上市公司股东的净利润同比上升0.73%-12.57%。2、公司在2022年8月并入成都鸿图奥兴科技有限公司（简称“鸿图奥兴”），鸿图奥兴比去年同期增加7个月经营业绩；公司在2023年1-2月比去年同期增加对四维尔丸井（广州）汽车零部件有限公司50%持股比例，归母净利润相应增加。3、2023年，公司积极应对市场变化，持续加大市场开拓力度，进一步优化业务布局，尤其在新能源汽车业务领域上，做好前沿产品研发和技术储备，着力提升技术工艺水平，加快产品的转型升级和结构优化，营业收入预计同比增长10%-20%；同时，公司聚焦重点目标任务，稳步推进各项工作，狠抓提质降本增效措施的落实，克服了关税增加、行业竞争加剧等不利因素的影响，经营业绩实现稳步提升。",1
002101.SZ,20240131,20231231,略减,-14.0505,-3.9514,40000.0,44700.0,46538.96,20240131,预计:净利润40000-44700,"公司2023年1-12月预计实现归属于上市公司股东的净利润在40,000万元–44,700万元之间，同比下降3.95%-14.05%；预计实现归属于上市公司股东扣除非经常性损益后的净利润在37,700万元–41,400万元之间，同比上升4.73%-15.01%。2023年度归属于上市公司股东的净利润同比下降、扣除非经常性损益后的归母净利润同比上升的主要原因如下：1、公司于上年同期完成了对原控股子公司广东宝龙汽车有限公司的股权转让，该股权转让事项对上年同期业绩产生正影响，导致归属于上市公司股东的净利润同比下降；若剔除该事项的影响，归属于上市公司股东的净利润同比上升0.73%-12.57%。2、公司在2022年8月并入成都鸿图奥兴科技有限公司（简称“鸿图奥兴”），鸿图奥兴比去年同期增加7个月经营业绩；公司在2023年1-2月比去年同期增加对四维尔丸井（广州）汽车零部件有限公司50%持股比例，归母净利润相应增加。3、2023年，公司积极应对市场变化，持续加大市场开拓力度，进一步优化业务布局，尤其在新能源汽车业务领域上，做好前沿产品研发和技术储备，着力提升技术工艺水平，加快产品的转型升级和结构优化，营业收入预计同比增长10%-20%；同时，公司聚焦重点目标任务，稳步推进各项工作，狠抓提质降本增效措施的落实，克服了关税增加、行业竞争加剧等不利因素的影响，经营业绩实现稳步提升。",0
002101.SZ,20230120,20221231,预增,50.31,60.31,45100.0,48100.0,30005.2,20230120,预计:净利润45100-48100,"公司2022年1-12月预计实现归属于上市公司股东的净利润在45,100万元–48,100万元之间，同比增长50.31%-60.31%。2022年度业绩同比增长主要原因如下：1、公司于报告期内完成了宝龙汽车股权转让及收购四维尔丸井其他股东股权，股权转让及股权收购事项对业绩产生正影响；2、2022年，公司积极应对市场变化，持续加大市场开拓力度，进一步优化业务布局，尤其在新能源汽车业务领域上，做好前沿产品研发和技术储备，着力提升技术工艺水平，加快产品的转型升级和结构优化，营业收入同比实现增长；同时，公司聚焦重点目标任务，稳步推进各项工作，狠抓提质降本增效措施的落实，克服了新冠疫情、局部限电、能源价格上涨等不利因素的影响，经营业绩实现稳步提升。",1
002101.SZ,20230120,20221231,预增,50.31,60.31,45100.0,48100.0,30005.2,20230120,预计净利润45100-48100万,"公司2022年1-12月预计实现归属于上市公司股东的净利润在45,100万元–48,100万元之间，同比增长50.31%-60.31%。2022年度业绩同比增长主要原因如下：1、公司于报告期内完成了宝龙汽车股权转让及收购四维尔丸井其他股东股权，股权转让及股权收购事项对业绩产生正影响；2、2022年，公司积极应对市场变化，持续加大市场开拓力度，进一步优化业务布局，尤其在新能源汽车业务领域上，做好前沿产品研发和技术储备，着力提升技术工艺水平，加快产品的转型升级和结构优化，营业收入同比实现增长；同时，公司聚焦重点目标任务，稳步推进各项工作，狠抓提质降本增效措施的落实，克服了新冠疫情、局部限电、能源价格上涨等不利因素的影响，经营业绩实现稳步提升。",0
002101.SZ,20220715,20220630,预增,65.0,75.0,21732.0,23049.0,13171.08,20220715,预计:净利润21732-23049,1、公司于报告期内完成了宝龙汽车股权转让，股权转让收益对业绩产生正影响；2、公司积极应对市场变化，扎实推进各项工作，持续推进全价值流及精益改善活动，落实提质降本增效措施，降低了疫情、原材料波动等外部环境变化对经营业绩的不利影响。,1
002101.SZ,20220715,20220630,预增,65.0,75.0,21732.0,23049.0,13171.08,20220715,预计净利润21732-23049万,1、公司于报告期内完成了宝龙汽车股权转让，股权转让收益对业绩产生正影响；2、公司积极应对市场变化，扎实推进各项工作，持续推进全价值流及精益改善活动，落实提质降本增效措施，降低了疫情、原材料波动等外部环境变化对经营业绩的不利影响。,0
002101.SZ,20211216,20211231,预增,70.0,90.0,26474.0,29588.0,15572.78,20211216,预计:净利润26474-29588,"公司预计2021年度归属于上市公司股东的净利润在26,473.73万元–29,588.28万元之间，同比增长70.00%-90.00%。全年业绩同比增长主要原因如下：1、上年度受年初爆发的新冠疫情影响，公司短期内订单急剧下降，上半年经营业绩出现亏损，影响2020年全年整体业绩，导致对比基数低。2、2021年，虽然全球疫情、汽车行业芯片短缺、原材料价格和出口运费上涨、限电政策等因素，对公司的生产经营产生了较大的压力，但公司通过加大新能源汽车业务的开拓力度，产品销售收入占比明显提高，同时通过狠抓各项开源节流、降本增效等措施的落实，降低了外部环境因素对经营业绩带来的不利影响。",1
002101.SZ,20211216,20211231,预增,70.0,90.0,26474.0,29588.0,15572.78,20211216,预计净利润26474-29588万,"公司预计2021年度归属于上市公司股东的净利润在26,473.73万元–29,588.28万元之间，同比增长70.00%-90.00%。全年业绩同比增长主要原因如下：1、上年度受年初爆发的新冠疫情影响，公司短期内订单急剧下降，上半年经营业绩出现亏损，影响2020年全年整体业绩，导致对比基数低。2、2021年，虽然全球疫情、汽车行业芯片短缺、原材料价格和出口运费上涨、限电政策等因素，对公司的生产经营产生了较大的压力，但公司通过加大新能源汽车业务的开拓力度，产品销售收入占比明显提高，同时通过狠抓各项开源节流、降本增效等措施的落实，降低了外部环境因素对经营业绩带来的不利影响。",0
002101.SZ,20210930,20210930,预增,133.66,154.92,18118.0,19767.0,7753.95,20210930,预计:净利润18118-19767,"公司2021年前三季度预计归属于上市公司股东的净利润在18,117.68万元–19,766.54万元之间，同比增长133.66%-154.92%。前三季度业绩同比增长主要原因：上年同期因受年初爆发的新冠疫情影响，公司短期内订单急剧下降，上半年经营业绩出现亏损，导致对比基数低，而今年随着汽车市场复苏，业绩同比实现了增长。公司2021年第三季度预计归属于上市公司股东的净利润在4,946.60万元–6,595.46万元之间，同比下降20.00%-40.00%。第三季度业绩同比下降主要原因：1、受芯片短缺影响，公司第三季度汽车类客户订单减少，营业收入同比下降；2、公司内部虽然已加大降本增效措施的实施力度，但原材料及海运费价格上涨明显，导致经营成本大幅度增加。",1
002101.SZ,20210930,20210930,预增,133.66,154.92,18118.0,19767.0,7753.95,20210930,预计净利润18118-19767万,"公司2021年前三季度预计归属于上市公司股东的净利润在18,117.68万元–19,766.54万元之间，同比增长133.66%-154.92%。前三季度业绩同比增长主要原因：上年同期因受年初爆发的新冠疫情影响，公司短期内订单急剧下降，上半年经营业绩出现亏损，导致对比基数低，而今年随着汽车市场复苏，业绩同比实现了增长。公司2021年第三季度预计归属于上市公司股东的净利润在4,946.60万元–6,595.46万元之间，同比下降20.00%-40.00%。第三季度业绩同比下降主要原因：1、受芯片短缺影响，公司第三季度汽车类客户订单减少，营业收入同比下降；2、公司内部虽然已加大降本增效措施的实施力度，但原材料及海运费价格上涨明显，导致经营成本大幅度增加。",0
002101.SZ,20210420,20210630,扭亏,2535.4858,3570.9371,11943.0,17021.0,-490.38,20210420,预计:净利润11943-17021,今年以来，随着国内经济和乘用车市场的复苏，公司第一季度业务呈现快速增长，预计第二季度销售将延续第一季度的增长趋势。虽然原材料价格上涨带来不利影响，但总体市场情况远好于去年同期，预计公司二季度的业绩将继续保持良好增长趋势。,1
002101.SZ,20210420,20210630,扭亏,2535.4858,3570.9371,11943.0,17021.0,-490.38,20210420,预计净利润11943-17021万,今年以来，随着国内经济和乘用车市场的复苏，公司第一季度业务呈现快速增长，预计第二季度销售将延续第一季度的增长趋势。虽然原材料价格上涨带来不利影响，但总体市场情况远好于去年同期，预计公司二季度的业绩将继续保持良好增长趋势。,0
002101.SZ,20210413,20210331,扭亏,198.5874,244.8217,4690.0,6889.0,-4757.21,20210413,预计:净利润4690-6889,"业绩同比增长原因:1,受益于汽车市场的持续复苏,公司2021年第一季度订单充足,产销量处于较高水平;2,上年一季度受国内年初爆发的新冠疫情影响,公司短期内订单下降,工厂未能进行正常经营生产,导致对比基数较低.",1
002101.SZ,20210413,20210331,扭亏,198.5874,244.8217,4690.0,6889.0,-4757.21,20210413,预计净利润4690-6889万,"业绩同比增长原因:1,受益于汽车市场的持续复苏,公司2021年第一季度订单充足,产销量处于较高水平;2,上年一季度受国内年初爆发的新冠疫情影响,公司短期内订单下降,工厂未能进行正常经营生产,导致对比基数较低.",0
002101.SZ,20201022,20201231,预增,282.31,472.98,10546.0,15805.0,2758.43,20201022,预计净利润10546-15805万,1、虽公司下半年订单比上半年有明显增加，但受新冠疫情的影响，预计全年销售量同比仍有所下降，主营业务利润相应有所下滑。2、公司上一年度计提了大额商誉减值准备，商誉减值对公司2019年度的经营业绩造成较大影响；根据截至目前的情况进行初步判断，公司收购的宁波四维尔资产组不存在减值迹象，预计本年度不会发生大额资产减值事项，公司将在本年度末对因收购宁波四维尔股权所形成的商誉进行减值测试，是否计提减值准备视测试结果而定。3、综上，公司的主营业务利润虽受疫情影响而有所下滑，但因预计本年度不会发生大额资产减值，全年业绩将同比增长。,0
002101.SZ,20201013,20200930,预减,-67.13,-64.94,7500.0,8000.0,22817.07,20200818,预计净利润7500-8000万,2020年第三季度国内汽车市场逐步恢复，公司订单较预期增加；同时，随着各国重启经济计划的施行，海外客户的订单也开始增加。因此，公司7-9月出货量同比增长，销售业绩好于预期。,0
002101.SZ,20200818,20200930,预减,-87.66,-81.51,2816.0,4219.0,22817.07,20200818,预计净利润2816-4219万,1、从第二季度开始，国内新冠肺炎疫情基本得到有效防控，公司上下游企业复工复产有序进行，公司内销订单逐步增加。预计第三季度随着国内汽车市场进一步回暖，公司内销订单将稳步增长。2、新冠疫情在全球蔓延，全球多地经济短暂停摆，公司主要国外客户于5月份复工，海外汽车零部件企业也继之陆续复产，公司的出口业务随之恢复，预计第三季度随着全球汽车产业链的复苏，公司外销订单将较之前增长。3、尽管预计第三季度收入环比会有增加，但是受疫情影响，公司1-9月收入同比仍出现下降，单位产品分摊的固定成本增加，业务毛利率同比下降，进而导致公司归母净利润同比有较大幅度下降。,1
002101.SZ,20200715,20200630,首亏,-104.293,-100.8586,-500.0,-100.0,11646.95,20200428,预计净利润-500~-100万,"1、公司于2020年6月16日召开的2019年度股东大会审议通过了《关于回购注销激励对象部分已获授但尚未解锁的限制性股票的议案》，公司财务部门根据该次股东大会决议进行会计处理，于报告期内冲回了以前年度计提的相应股权激励费用，影响公司1-6月归属于上市公司股东的净利润比原预计增加1,304.79万元。2、前次业绩预告因上述限制性股票回购事项尚未进入审批决策阶段，故未对相关影响数据进行预计。公司已于2020年5月26日披露的《关于回购注销激励对象部分已获授但尚未解锁的限制性股票的公告》中对本次限制性股票回购注销的影响数据予以说明。",0
002101.SZ,20200428,20200630,首亏,-154.6753,-112.5355,-6368.0,-1460.0,11646.95,20200428,预计净利润-6368~-1460万,今年1月开始新冠肺炎疫情逐渐在全球蔓延，至今尚未得到有效遏制，形势仍然严峻。全球多地封城、经济停摆。虽然目前国内疫情防控取得阶段性胜利，公司各地工厂和国内主机厂已于第一季度复工，但是由于海外汽车零部件企业陆续停工，影响国内主机厂无法正常生产，导致公司内销订单同比减少；同时公司主要国外客户因疫情停工，导致公司外销订单同比减少，公司的出口业务暂时停滞。以上原因造成公司1-6月业务量大幅减少，营业收入大幅下降，利润大幅下滑。,1
002101.SZ,20200411,20200331,首亏,-218.21,-190.38,-5506.0,-4210.0,4658.19,20200411,预计净利润-5506~-4210万,"业绩同比下降原因:报告期内,由于受国内今年1月爆发的新冠肺炎疫情影响,公司下属各地工厂复工复产时间较原计划推迟,部分下属企业人员返工受限,以及下游主机厂客户延迟开工,导致公司本报告期营业收入大幅下降;同时由于实现的毛利不能覆盖固定成本而导致利润的大幅下滑.",0
002101.SZ,20200123,20191231,预减,-96.14,-85.14,1300.0,5000.0,33654.01,20191029,预计净利润1300-5000万,"1、受宏观经济下行、汽车行业疲软、中美贸易战、运钞车市场萎缩等因素影响，未来市场预期较不乐观。公司判断因收购宝龙汽车和宁波四维尔两家公司形成的商誉所在资产组出现了减值迹象，进行减值测试后预计将计提商誉减值准备金额25,000万元~30,000万元，从而导致公司2019年度业绩大幅下降。2、公司汽车零部件业务的销售量同比保持平稳，但受汽车行业市场下滑和中美贸易摩擦等因素的影响，关税成本同比大幅增加，导致营业利润同比下降；宝龙汽车报告期内获取的订单同比减少，产销量及效益同比大幅下降。截至本公告披露日，公司经营情况稳定，本次拟计提商誉减值事项不会对公司的日常经营管理和主营业务正常开展产生重大影响，亦不会影响公司的持续经营能力和现金流。若剔除商誉减值因素，预计2019年度归属于上市公司股东的净利润约为31,300.00万元~34,665.00万元，同比变动幅度为-20.13%~-11.55%。",0
