ts_code,ann_date,end_date,type,p_change_min,p_change_max,net_profit_min,net_profit_max,last_parent_net,first_ann_date,summary,change_reason,update_flag
002158.SZ,20211014,20210930,预增,47.0,52.0,35396.0,36600.0,24078.7,20211014,预计:净利润35396-36600,公司2021年1~9月归属于上市公司股东的净利润较上年同期上升的主要原因：1、受益于下游行业良好发展态势以及国内新冠疫情控制稳定，公司抓住市场机遇，加大生产及营销力度，积极开发节能环保新产品，使得销售收入较上年同期有所增长；2、因销售量增加，整体产能利用率较高。同时，公司通过预算管理，降本增效等措施提升经营效率，使得净利润较上年同期有所增长。,1
002158.SZ,20211014,20210930,预增,47.0,52.0,35396.0,36600.0,24078.7,20211014,预计净利润35396-36600万,公司2021年1~9月归属于上市公司股东的净利润较上年同期上升的主要原因：1、受益于下游行业良好发展态势以及国内新冠疫情控制稳定，公司抓住市场机遇，加大生产及营销力度，积极开发节能环保新产品，使得销售收入较上年同期有所增长；2、因销售量增加，整体产能利用率较高。同时，公司通过预算管理，降本增效等措施提升经营效率，使得净利润较上年同期有所增长。,0
002158.SZ,20210714,20210630,预增,65.0,75.0,19331.0,20503.0,11715.96,20210714,预计:净利润19331-20503,"公司2021年半年度归属于上市公司股东的净利润较上年同期上升的主要原因:1,受益于国内新冠疫情控制稳定以及下游行业良好发展态势,公司抓住市场机遇,加大生产及营销力度,积极开发节能环保新产品,使得销售收入较上年同期有所增长.2,因销售量增加,整体产能利用率较高.同时,公司通过预算管理,降本增效等措施提升经营效率,使得净利润较上年同期有所增长.",1
002158.SZ,20210714,20210630,预增,65.0,75.0,19331.0,20503.0,11715.96,20210714,预计净利润19331-20503万,"公司2021年半年度归属于上市公司股东的净利润较上年同期上升的主要原因:1,受益于国内新冠疫情控制稳定以及下游行业良好发展态势,公司抓住市场机遇,加大生产及营销力度,积极开发节能环保新产品,使得销售收入较上年同期有所增长.2,因销售量增加,整体产能利用率较高.同时,公司通过预算管理,降本增效等措施提升经营效率,使得净利润较上年同期有所增长.",0
002158.SZ,20210413,20210331,预增,150.0,160.0,7237.0,7527.0,2894.98,20210413,预计:净利润7237-7527,"1,受益下游行业良好发展态势以及国内新冠疫情控制稳定,公司抓住市场机遇,加大生产及营销力度,积极开发节能环保新产品,使得销售收入较上年同期有所增长.2,因销售量增加,整体产能利用率较高.同时,通过预算管理,降本增效等措施提升经营效率,使得净利润较上年同期有所增长.",1
002158.SZ,20210413,20210331,预增,150.0,160.0,7237.0,7527.0,2894.98,20210413,预计净利润7237-7527万,"1,受益下游行业良好发展态势以及国内新冠疫情控制稳定,公司抓住市场机遇,加大生产及营销力度,积极开发节能环保新产品,使得销售收入较上年同期有所增长.2,因销售量增加,整体产能利用率较高.同时,通过预算管理,降本增效等措施提升经营效率,使得净利润较上年同期有所增长.",0
002158.SZ,20210130,20201231,预增,40.0,55.0,34473.0,38166.0,24623.52,20210130,预计净利润34473-38166万,"报告期内，归属于上市公司股东的净利润预计区间为34,472.93万元~38,166.46万元，比上年同期增长40.00%~55.00%，扣除非经常性损益后的净利润预计区间为30,849.07万元~34,040.35万元，比上年同期增长45.00%~60.00%，主要原因为：1、2020年度，虽然受全球新冠肺炎疫情影响，但公司积极采取措施做好防疫工作，并抓紧市场机遇，扎实做好生产经营，加大市场营销力度，积极开发节能环保新产品，使得销售收入较上年同期有所增长。2、因销售量增加，整体产能利用率较高，同时，产品结构及客户结构有所变动，以及成本费用控制较好，从而导致净利润较上年同期有所增长。",0
002158.SZ,20200414,20200331,略增,0.0,10.0,2685.0,2953.0,2684.95,20200414,预计净利润2685-2953万,"新冠疫情的影响,公司在政府许可后第一时间有序复工,积极恢复生产,及时调整经营生产,尽可能降低疫情的不利影响.在公司管理层的带领以及全体员工的努力下,2020年第一季度归属于上市公司股东的净利润预计增长0%~10%.",0
